#   Mouse for Windows
# 0x05, 0x01,                    // Usage Page (Generic Desktop)        0
# 0x09, 0x06,                    // Usage (Keyboard)                    2
# 0xa1, 0x01,                    // Collection (Application)            4
# 0x05, 0x07,                    //  Usage Page (Keyboard)              6
# 0x19, 0xe0,                    //  Usage Minimum (224)                8
# 0x29, 0xe7,                    //  Usage Maximum (231)                10
# 0x15, 0x00,                    //  Logical Minimum (0)                12
# 0x25, 0x01,                    //  Logical Maximum (1)                14
# 0x75, 0x01,                    //  Report Size (1)                    16
# 0x95, 0x08,                    //  Report Count (8)                   18
# 0x81, 0x02,                    //  Input (Data,Var,Abs)               20
# 0x95, 0x01,                    //  Report Count (1)                   22
# 0x75, 0x08,                    //  Report Size (8)                    24
# 0x81, 0x01,                    //  Input (Cnst,Arr,Abs)               26
# 0x95, 0x03,                    //  Report Count (3)                   28
# 0x75, 0x01,                    //  Report Size (1)                    30
# 0x05, 0x08,                    //  Usage Page (LEDs)                  32
# 0x19, 0x01,                    //  Usage Minimum (1)                  34
# 0x29, 0x03,                    //  Usage Maximum (3)                  36
# 0x91, 0x02,                    //  Output (Data,Var,Abs)              38
# 0x95, 0x01,                    //  Report Count (1)                   40
# 0x75, 0x05,                    //  Report Size (5)                    42
# 0x91, 0x01,                    //  Output (Cnst,Arr,Abs)              44
# 0x95, 0x06,                    //  Report Count (6)                   46
# 0x75, 0x08,                    //  Report Size (8)                    48
# 0x15, 0x00,                    //  Logical Minimum (0)                50
# 0x26, 0xff, 0x00,              //  Logical Maximum (255)              52
# 0x05, 0x07,                    //  Usage Page (Keyboard)              55
# 0x19, 0x00,                    //  Usage Minimum (0)                  57
# 0x2a, 0xff, 0x00,              //  Usage Maximum (255)                59
# 0x81, 0x00,                    //  Input (Data,Arr,Abs)               62
# 0xc0,                          // End Collection                      64
# 
R: 65 05 01 09 06 a1 01 05 07 19 e0 29 e7 15 00 25 01 75 01 95 08 81 02 95 01 75 08 81 01 95 03 75 01 05 08 19 01 29 03 91 02 95 01 75 05 91 01 95 06 75 08 15 00 26 ff 00 05 07 19 00 2a ff 00 81 00 c0
N:   Mouse for Windows
I: 3 2f24 0135
#  LeftControl: 0 | LeftShift: 0 | LeftAlt: 0 | Left GUI: 0 | RightControl: 0 | RightShift: 0 | RightAlt: 0 | Right GUI: 0 | # |Keyboard ['w and W', '0x70000', '0x70000', '0x70000', '0x70000', '0x70000'] 
E: 000000.000000 8 00 00 1a 00 00 00 00 00
#  LeftControl: 0 | LeftShift: 0 | LeftAlt: 0 | Left GUI: 0 | RightControl: 0 | RightShift: 0 | RightAlt: 0 | Right GUI: 0 | # |Keyboard ['0x70000', '0x70000', '0x70000', '0x70000', '0x70000', '0x70000'] 
E: 000000.176054 8 00 00 00 00 00 00 00 00
#  LeftControl: 0 | LeftShift: 0 | LeftAlt: 0 | Left GUI: 0 | RightControl: 0 | RightShift: 0 | RightAlt: 0 | Right GUI: 0 | # |Keyboard ['s and S', '0x70000', '0x70000', '0x70000', '0x70000', '0x70000'] 
E: 000000.600024 8 00 00 16 00 00 00 00 00
#  LeftControl: 0 | LeftShift: 0 | LeftAlt: 0 | Left GUI: 0 | RightControl: 0 | RightShift: 0 | RightAlt: 0 | Right GUI: 0 | # |Keyboard ['0x70000', '0x70000', '0x70000', '0x70000', '0x70000', '0x70000'] 
E: 000000.772394 8 00 00 00 00 00 00 00 00
#  LeftControl: 0 | LeftShift: 0 | LeftAlt: 0 | Left GUI: 0 | RightControl: 0 | RightShift: 0 | RightAlt: 0 | Right GUI: 0 | # |Keyboard ['a and A', '0x70000', '0x70000', '0x70000', '0x70000', '0x70000'] 
E: 000001.088302 8 00 00 04 00 00 00 00 00
#  LeftControl: 0 | LeftShift: 0 | LeftAlt: 0 | Left GUI: 0 | RightControl: 0 | RightShift: 0 | RightAlt: 0 | Right GUI: 0 | # |Keyboard ['0x70000', '0x70000', '0x70000', '0x70000', '0x70000', '0x70000'] 
E: 000001.252300 8 00 00 00 00 00 00 00 00
#  LeftControl: 0 | LeftShift: 0 | LeftAlt: 0 | Left GUI: 0 | RightControl: 0 | RightShift: 0 | RightAlt: 0 | Right GUI: 0 | # |Keyboard ['d and D', '0x70000', '0x70000', '0x70000', '0x70000', '0x70000'] 
E: 000001.500072 8 00 00 07 00 00 00 00 00
#  LeftControl: 0 | LeftShift: 0 | LeftAlt: 0 | Left GUI: 0 | RightControl: 0 | RightShift: 0 | RightAlt: 0 | Right GUI: 0 | # |Keyboard ['0x70000', '0x70000', '0x70000', '0x70000', '0x70000', '0x70000'] 
E: 000001.656350 8 00 00 00 00 00 00 00 00
#  LeftControl: 1 | LeftShift: 0 | LeftAlt: 0 | Left GUI: 0 | RightControl: 0 | RightShift: 0 | RightAlt: 0 | Right GUI: 0 | # |Keyboard ['Keypad /', '0x70000', '0x70000', '0x70000', '0x70000', '0x70000'] 
E: 000003.832265 8 01 00 54 00 00 00 00 00
#  LeftControl: 0 | LeftShift: 0 | LeftAlt: 0 | Left GUI: 0 | RightControl: 0 | RightShift: 0 | RightAlt: 0 | Right GUI: 0 | # |Keyboard ['0x70000', '0x70000', '0x70000', '0x70000', '0x70000', '0x70000'] 
E: 000004.128238 8 00 00 00 00 00 00 00 00
#  LeftControl: 0 | LeftShift: 0 | LeftAlt: 0 | Left GUI: 0 | RightControl: 0 | RightShift: 0 | RightAlt: 0 | Right GUI: 0 | # |Keyboard ['UpArrow', '0x70000', '0x70000', '0x70000', '0x70000', '0x70000'] 
E: 000018.031726 8 00 00 52 00 00 00 00 00
#  LeftControl: 0 | LeftShift: 0 | LeftAlt: 0 | Left GUI: 0 | RightControl: 0 | RightShift: 0 | RightAlt: 0 | Right GUI: 0 | # |Keyboard ['0x70000', '0x70000', '0x70000', '0x70000', '0x70000', '0x70000'] 
E: 000018.167487 8 00 00 00 00 00 00 00 00
#  LeftControl: 0 | LeftShift: 0 | LeftAlt: 0 | Left GUI: 0 | RightControl: 0 | RightShift: 0 | RightAlt: 0 | Right GUI: 0 | # |Keyboard ['DownArrow', '0x70000', '0x70000', '0x70000', '0x70000', '0x70000'] 
E: 000030.262782 8 00 00 51 00 00 00 00 00
#  LeftControl: 0 | LeftShift: 0 | LeftAlt: 0 | Left GUI: 0 | RightControl: 0 | RightShift: 0 | RightAlt: 0 | Right GUI: 0 | # |Keyboard ['0x70000', '0x70000', '0x70000', '0x70000', '0x70000', '0x70000'] 
E: 000030.406731 8 00 00 00 00 00 00 00 00
#  LeftControl: 0 | LeftShift: 0 | LeftAlt: 0 | Left GUI: 0 | RightControl: 0 | RightShift: 0 | RightAlt: 0 | Right GUI: 0 | # |Keyboard ['UpArrow', '0x70000', '0x70000', '0x70000', '0x70000', '0x70000'] 
E: 000031.374653 8 00 00 52 00 00 00 00 00
#  LeftControl: 0 | LeftShift: 0 | LeftAlt: 0 | Left GUI: 0 | RightControl: 0 | RightShift: 0 | RightAlt: 0 | Right GUI: 0 | # |Keyboard ['0x70000', '0x70000', '0x70000', '0x70000', '0x70000', '0x70000'] 
E: 000031.522915 8 00 00 00 00 00 00 00 00
#  LeftControl: 0 | LeftShift: 0 | LeftAlt: 0 | Left GUI: 0 | RightControl: 0 | RightShift: 0 | RightAlt: 0 | Right GUI: 0 | # |Keyboard ['LeftArrow', '0x70000', '0x70000', '0x70000', '0x70000', '0x70000'] 
E: 000031.914956 8 00 00 50 00 00 00 00 00
#  LeftControl: 0 | LeftShift: 0 | LeftAlt: 0 | Left GUI: 0 | RightControl: 0 | RightShift: 0 | RightAlt: 0 | Right GUI: 0 | # |Keyboard ['0x70000', '0x70000', '0x70000', '0x70000', '0x70000', '0x70000'] 
E: 000032.026829 8 00 00 00 00 00 00 00 00
#  LeftControl: 0 | LeftShift: 0 | LeftAlt: 0 | Left GUI: 0 | RightControl: 0 | RightShift: 0 | RightAlt: 0 | Right GUI: 0 | # |Keyboard ['RightArrow', '0x70000', '0x70000', '0x70000', '0x70000', '0x70000'] 
E: 000032.386620 8 00 00 4f 00 00 00 00 00
#  LeftControl: 0 | LeftShift: 0 | LeftAlt: 0 | Left GUI: 0 | RightControl: 0 | RightShift: 0 | RightAlt: 0 | Right GUI: 0 | # |Keyboard ['0x70000', '0x70000', '0x70000', '0x70000', '0x70000', '0x70000'] 
E: 000032.490651 8 00 00 00 00 00 00 00 00
#  LeftControl: 1 | LeftShift: 0 | LeftAlt: 0 | Left GUI: 0 | RightControl: 0 | RightShift: 0 | RightAlt: 0 | Right GUI: 0 | # |Keyboard ['Keypad /', '0x70000', '0x70000', '0x70000', '0x70000', '0x70000'] 
E: 000034.282515 8 01 00 54 00 00 00 00 00
#  LeftControl: 0 | LeftShift: 0 | LeftAlt: 0 | Left GUI: 0 | RightControl: 0 | RightShift: 0 | RightAlt: 0 | Right GUI: 0 | # |Keyboard ['0x70000', '0x70000', '0x70000', '0x70000', '0x70000', '0x70000'] 
E: 000034.579331 8 00 00 00 00 00 00 00 00
