#   Mouse for Windows
# 0x05, 0x01,                    // Usage Page (Generic Desktop)        0
# 0x09, 0x02,                    // Usage (Mouse)                       2
# 0xa1, 0x01,                    // Collection (Application)            4
# 0x09, 0x01,                    //  Usage (Pointer)                    6
# 0xa1, 0x01,                    //  Collection (Application)           8
# 0x05, 0x09,                    //   Usage Page (Button)               10
# 0x19, 0x01,                    //   Usage Minimum (1)                 12
# 0x29, 0x05,                    //   Usage Maximum (5)                 14
# 0x15, 0x00,                    //   Logical Minimum (0)               16
# 0x25, 0x01,                    //   Logical Maximum (1)               18
# 0x95, 0x05,                    //   Report Count (5)                  20
# 0x75, 0x01,                    //   Report Size (1)                   22
# 0x81, 0x02,                    //   Input (Data,Var,Abs)              24
# 0x95, 0x01,                    //   Report Count (1)                  26
# 0x75, 0x03,                    //   Report Size (3)                   28
# 0x81, 0x01,                    //   Input (Cnst,Arr,Abs)              30
# 0x05, 0x01,                    //   Usage Page (Generic Desktop)      32
# 0x09, 0x30,                    //   Usage (X)                         34
# 0x09, 0x31,                    //   Usage (Y)                         36
# 0x09, 0x38,                    //   Usage (Wheel)                     38
# 0x15, 0x81,                    //   Logical Minimum (-127)            40
# 0x25, 0x7f,                    //   Logical Maximum (127)             42
# 0x75, 0x08,                    //   Report Size (8)                   44
# 0x95, 0x03,                    //   Report Count (3)                  46
# 0x81, 0x06,                    //   Input (Data,Var,Rel)              48
# 0xc0,                          //  End Collection                     50
# 0xc0,                          // End Collection                      51
# 
R: 52 05 01 09 02 a1 01 09 01 a1 01 05 09 19 01 29 05 15 00 25 01 95 05 75 01 81 02 95 01 75 03 81 01 05 01 09 30 09 31 09 38 15 81 25 7f 75 08 95 03 81 06 c0 c0
N:   Mouse for Windows
I: 3 2f24 0135
#  Button: 0  0  0  0  0 | # | X:   -1 | Y:    0 | Wheel:    0 
E: 000000.000000 4 00 ff 00 00
#  Button: 0  0  0  0  0 | # | X:   -1 | Y:    0 | Wheel:    0 
E: 000000.008420 4 00 ff 00 00
#  Button: 0  0  0  0  0 | # | X:   -1 | Y:    0 | Wheel:    0 
E: 000000.016105 4 00 ff 00 00
#  Button: 0  0  0  0  0 | # | X:   -1 | Y:    0 | Wheel:    0 
E: 000000.024000 4 00 ff 00 00
#  Button: 0  0  0  0  0 | # | X:   -2 | Y:    0 | Wheel:    0 
E: 000000.032270 4 00 fe 00 00
#  Button: 0  0  0  0  0 | # | X:   -2 | Y:    0 | Wheel:    0 
E: 000000.039948 4 00 fe 00 00
#  Button: 0  0  0  0  0 | # | X:   -2 | Y:    0 | Wheel:    0 
E: 000000.047936 4 00 fe 00 00
#  Button: 0  0  0  0  0 | # | X:   -2 | Y:    0 | Wheel:    0 
E: 000000.055936 4 00 fe 00 00
#  Button: 0  0  0  0  0 | # | X:   -2 | Y:    0 | Wheel:    0 
E: 000000.063875 4 00 fe 00 00
#  Button: 0  0  0  0  0 | # | X:   -2 | Y:    0 | Wheel:    0 
E: 000000.071953 4 00 fe 00 00
#  Button: 0  0  0  0  0 | # | X:   -2 | Y:    0 | Wheel:    0 
E: 000000.079924 4 00 fe 00 00
#  Button: 0  0  0  0  0 | # | X:   -2 | Y:    0 | Wheel:    0 
E: 000000.088098 4 00 fe 00 00
#  Button: 0  0  0  0  0 | # | X:   -2 | Y:    0 | Wheel:    0 
E: 000000.095959 4 00 fe 00 00
#  Button: 0  0  0  0  0 | # | X:   -2 | Y:    0 | Wheel:    0 
E: 000000.103943 4 00 fe 00 00
#  Button: 0  0  0  0  0 | # | X:   -2 | Y:    0 | Wheel:    0 
E: 000000.111967 4 00 fe 00 00
#  Button: 0  0  0  0  0 | # | X:   -2 | Y:    0 | Wheel:    0 
E: 000000.119945 4 00 fe 00 00
#  Button: 0  0  0  0  0 | # | X:   -1 | Y:    0 | Wheel:    0 
E: 000000.127896 4 00 ff 00 00
#  Button: 0  0  0  0  0 | # | X:    0 | Y:   -1 | Wheel:    0 
E: 000000.575918 4 00 00 ff 00
#  Button: 0  0  0  0  0 | # | X:    0 | Y:   -2 | Wheel:    0 
E: 000000.583886 4 00 00 fe 00
#  Button: 0  0  0  0  0 | # | X:    0 | Y:   -3 | Wheel:    0 
E: 000000.591927 4 00 00 fd 00
#  Button: 0  0  0  0  0 | # | X:    0 | Y:   -3 | Wheel:    0 
E: 000000.599869 4 00 00 fd 00
#  Button: 0  0  0  0  0 | # | X:    0 | Y:   -4 | Wheel:    0 
E: 000000.607892 4 00 00 fc 00
#  Button: 0  0  0  0  0 | # | X:    0 | Y:   -4 | Wheel:    0 
E: 000000.615885 4 00 00 fc 00
#  Button: 0  0  0  0  0 | # | X:    0 | Y:   -4 | Wheel:    0 
E: 000000.623904 4 00 00 fc 00
#  Button: 0  0  0  0  0 | # | X:    0 | Y:   -4 | Wheel:    0 
E: 000000.631893 4 00 00 fc 00
#  Button: 0  0  0  0  0 | # | X:    0 | Y:   -4 | Wheel:    0 
E: 000000.639898 4 00 00 fc 00
#  Button: 0  0  0  0  0 | # | X:    0 | Y:   -4 | Wheel:    0 
E: 000000.647815 4 00 00 fc 00
#  Button: 0  0  0  0  0 | # | X:    0 | Y:   -4 | Wheel:    0 
E: 000000.655799 4 00 00 fc 00
#  Button: 0  0  0  0  0 | # | X:    0 | Y:   -4 | Wheel:    0 
E: 000000.663842 4 00 00 fc 00
#  Button: 0  0  0  0  0 | # | X:    0 | Y:   -4 | Wheel:    0 
E: 000000.671845 4 00 00 fc 00
#  Button: 0  0  0  0  0 | # | X:    0 | Y:   -4 | Wheel:    0 
E: 000000.679832 4 00 00 fc 00
#  Button: 0  0  0  0  0 | # | X:    0 | Y:   -4 | Wheel:    0 
E: 000000.687855 4 00 00 fc 00
#  Button: 0  0  0  0  0 | # | X:    0 | Y:   -3 | Wheel:    0 
E: 000000.695907 4 00 00 fd 00
#  Button: 0  0  0  0  0 | # | X:    0 | Y:   -3 | Wheel:    0 
E: 000000.703980 4 00 00 fd 00
#  Button: 0  0  0  0  0 | # | X:    0 | Y:   -2 | Wheel:    0 
E: 000000.712055 4 00 00 fe 00
#  Button: 0  0  0  0  0 | # | X:    0 | Y:   -2 | Wheel:    0 
E: 000000.719912 4 00 00 fe 00
#  Button: 0  0  0  0  0 | # | X:    0 | Y:   -2 | Wheel:    0 
E: 000000.727929 4 00 00 fe 00
#  Button: 0  0  0  0  0 | # | X:    2 | Y:    0 | Wheel:    0 
E: 000001.136350 4 00 02 00 00
#  Button: 0  0  0  0  0 | # | X:    3 | Y:    0 | Wheel:    0 
E: 000001.143998 4 00 03 00 00
#  Button: 0  0  0  0  0 | # | X:    2 | Y:    0 | Wheel:    0 
E: 000001.152129 4 00 02 00 00
#  Button: 0  0  0  0  0 | # | X:    2 | Y:    0 | Wheel:    0 
E: 000001.159930 4 00 02 00 00
#  Button: 0  0  0  0  0 | # | X:    2 | Y:    0 | Wheel:    0 
E: 000001.167935 4 00 02 00 00
#  Button: 0  0  0  0  0 | # | X:    2 | Y:    0 | Wheel:    0 
E: 000001.175952 4 00 02 00 00
#  Button: 0  0  0  0  0 | # | X:    2 | Y:    0 | Wheel:    0 
E: 000001.183994 4 00 02 00 00
#  Button: 0  0  0  0  0 | # | X:    2 | Y:    0 | Wheel:    0 
E: 000001.191941 4 00 02 00 00
#  Button: 0  0  0  0  0 | # | X:    2 | Y:    0 | Wheel:    0 
E: 000001.199922 4 00 02 00 00
#  Button: 0  0  0  0  0 | # | X:    2 | Y:    0 | Wheel:    0 
E: 000001.207904 4 00 02 00 00
#  Button: 0  0  0  0  0 | # | X:    2 | Y:    0 | Wheel:    0 
E: 000001.215903 4 00 02 00 00
#  Button: 0  0  0  0  0 | # | X:    2 | Y:    0 | Wheel:    0 
E: 000001.223981 4 00 02 00 00
#  Button: 0  0  0  0  0 | # | X:    2 | Y:    0 | Wheel:    0 
E: 000001.231944 4 00 02 00 00
#  Button: 0  0  0  0  0 | # | X:    2 | Y:    0 | Wheel:    0 
E: 000001.239907 4 00 02 00 00
#  Button: 0  0  0  0  0 | # | X:    2 | Y:    0 | Wheel:    0 
E: 000001.247916 4 00 02 00 00
#  Button: 0  0  0  0  0 | # | X:    2 | Y:    0 | Wheel:    0 
E: 000001.255832 4 00 02 00 00
#  Button: 0  0  0  0  0 | # | X:    2 | Y:    0 | Wheel:    0 
E: 000001.264467 4 00 02 00 00
#  Button: 0  0  0  0  0 | # | X:    1 | Y:    0 | Wheel:    0 
E: 000001.272183 4 00 01 00 00
#  Button: 0  0  0  0  0 | # | X:    1 | Y:    0 | Wheel:    0 
E: 000001.279926 4 00 01 00 00
#  Button: 0  0  0  0  0 | # | X:    1 | Y:    0 | Wheel:    0 
E: 000001.287942 4 00 01 00 00
#  Button: 0  0  0  0  0 | # | X:    0 | Y:    1 | Wheel:    0 
E: 000001.703920 4 00 00 01 00
#  Button: 0  0  0  0  0 | # | X:    0 | Y:    2 | Wheel:    0 
E: 000001.711873 4 00 00 02 00
#  Button: 0  0  0  0  0 | # | X:    0 | Y:    1 | Wheel:    0 
E: 000001.719915 4 00 00 01 00
#  Button: 0  0  0  0  0 | # | X:    0 | Y:    1 | Wheel:    0 
E: 000001.727919 4 00 00 01 00
#  Button: 0  0  0  0  0 | # | X:    0 | Y:    1 | Wheel:    0 
E: 000001.735918 4 00 00 01 00
#  Button: 0  0  0  0  0 | # | X:    0 | Y:    1 | Wheel:    0 
E: 000001.743967 4 00 00 01 00
#  Button: 0  0  0  0  0 | # | X:    0 | Y:    2 | Wheel:    0 
E: 000001.751937 4 00 00 02 00
#  Button: 0  0  0  0  0 | # | X:    0 | Y:    3 | Wheel:    0 
E: 000001.759945 4 00 00 03 00
#  Button: 0  0  0  0  0 | # | X:    0 | Y:    3 | Wheel:    0 
E: 000001.767929 4 00 00 03 00
#  Button: 0  0  0  0  0 | # | X:    0 | Y:    3 | Wheel:    0 
E: 000001.775861 4 00 00 03 00
#  Button: 0  0  0  0  0 | # | X:    0 | Y:    3 | Wheel:    0 
E: 000001.783856 4 00 00 03 00
#  Button: 0  0  0  0  0 | # | X:    0 | Y:    3 | Wheel:    0 
E: 000001.791814 4 00 00 03 00
#  Button: 0  0  0  0  0 | # | X:    0 | Y:    3 | Wheel:    0 
E: 000001.799888 4 00 00 03 00
#  Button: 0  0  0  0  0 | # | X:    0 | Y:    3 | Wheel:    0 
E: 000001.807899 4 00 00 03 00
#  Button: 0  0  0  0  0 | # | X:    0 | Y:    3 | Wheel:    0 
E: 000001.815931 4 00 00 03 00
#  Button: 0  0  0  0  0 | # | X:    0 | Y:    3 | Wheel:    0 
E: 000001.823910 4 00 00 03 00
#  Button: 0  0  0  0  0 | # | X:    0 | Y:    3 | Wheel:    0 
E: 000001.831876 4 00 00 03 00
#  Button: 0  0  0  0  0 | # | X:    0 | Y:    3 | Wheel:    0 
E: 000001.839996 4 00 00 03 00
#  Button: 0  0  0  0  0 | # | X:    0 | Y:    3 | Wheel:    0 
E: 000001.847907 4 00 00 03 00
#  Button: 0  0  0  0  0 | # | X:    0 | Y:    3 | Wheel:    0 
E: 000001.855926 4 00 00 03 00
#  Button: 0  1  0  0  0 | # | X:    0 | Y:    0 | Wheel:    0 
E: 000002.424333 4 02 00 00 00
#  Button: 0  0  0  0  0 | # | X:    0 | Y:    0 | Wheel:    0 
E: 000002.496228 4 00 00 00 00
#  Button: 1  0  0  0  0 | # | X:    0 | Y:    0 | Wheel:    0 
E: 000003.072640 4 01 00 00 00
#  Button: 0  0  0  0  0 | # | X:    0 | Y:    0 | Wheel:    0 
E: 000003.183990 4 00 00 00 00
#  Button: 0  0  1  0  0 | # | X:    0 | Y:    0 | Wheel:    0 
E: 000003.471908 4 04 00 00 00
#  Button: 0  0  0  0  0 | # | X:    0 | Y:    0 | Wheel:    0 
E: 000003.648006 4 00 00 00 00
#  Button: 0  0  0  0  0 | # | X:    0 | Y:    0 | Wheel:    1 
E: 000020.191635 4 00 00 00 01
