# SINO WEALTH 唰匀䈀 䴀漀甀猀攀
# 0x05, 0x01,                    // Usage Page (Generic Desktop)        0
# 0x09, 0x02,                    // Usage (Mouse)                       2
# 0xa1, 0x01,                    // Collection (Application)            4
# 0x09, 0x01,                    //  Usage (Pointer)                    6
# 0xa1, 0x00,                    //  Collection (Physical)              8
# 0x05, 0x09,                    //   Usage Page (Button)               10
# 0x19, 0x01,                    //   Usage Minimum (1)                 12
# 0x29, 0x05,                    //   Usage Maximum (5)                 14
# 0x15, 0x00,                    //   Logical Minimum (0)               16
# 0x25, 0x01,                    //   Logical Maximum (1)               18
# 0x95, 0x05,                    //   Report Count (5)                  20
# 0x75, 0x01,                    //   Report Size (1)                   22
# 0x81, 0x02,                    //   Input (Data,Var,Abs)              24
# 0x95, 0x01,                    //   Report Count (1)                  26
# 0x75, 0x03,                    //   Report Size (3)                   28
# 0x81, 0x01,                    //   Input (Cnst,Arr,Abs)              30
# 0x05, 0x01,                    //   Usage Page (Generic Desktop)      32
# 0x09, 0x30,                    //   Usage (X)                         34
# 0x09, 0x31,                    //   Usage (Y)                         36
# 0x15, 0x80,                    //   Logical Minimum (-128)            38
# 0x25, 0x7f,                    //   Logical Maximum (127)             40
# 0x75, 0x08,                    //   Report Size (8)                   42
# 0x95, 0x02,                    //   Report Count (2)                  44
# 0x81, 0x06,                    //   Input (Data,Var,Rel)              46
# 0x09, 0x38,                    //   Usage (Wheel)                     48
# 0x15, 0x80,                    //   Logical Minimum (-128)            50
# 0x25, 0x7f,                    //   Logical Maximum (127)             52
# 0x75, 0x08,                    //   Report Size (8)                   54
# 0x95, 0x01,                    //   Report Count (1)                  56
# 0x81, 0x06,                    //   Input (Data,Var,Rel)              58
# 0xc0,                          //  End Collection                     60
# 0xc0,                          // End Collection                      61
# 
R: 62 05 01 09 02 a1 01 09 01 a1 00 05 09 19 01 29 05 15 00 25 01 95 05 75 01 81 02 95 01 75 03 81 01 05 01 09 30 09 31 15 80 25 7f 75 08 95 02 81 06 09 38 15 80 25 7f 75 08 95 01 81 06 c0 c0
N: SINO WEALTH 唰匀䈀 䴀漀甀猀攀
I: 3 0603 1010
#  Button: 0  0  0  0  0 | # | X:    5 | Y:    0 | Wheel:    0 
E: 000000.000000 4 00 05 00 00
#  Button: 0  0  0  0  0 | # | X:    6 | Y:    0 | Wheel:    0 
E: 000000.007866 4 00 06 00 00
#  Button: 0  0  0  0  0 | # | X:    7 | Y:    0 | Wheel:    0 
E: 000000.015850 4 00 07 00 00
#  Button: 0  0  0  0  0 | # | X:    7 | Y:    0 | Wheel:    0 
E: 000000.023840 4 00 07 00 00
#  Button: 0  0  0  0  0 | # | X:    5 | Y:   -1 | Wheel:    0 
E: 000000.031876 4 00 05 ff 00
#  Button: 0  0  0  0  0 | # | X:    5 | Y:   -1 | Wheel:    0 
E: 000000.039872 4 00 05 ff 00
#  Button: 0  0  0  0  0 | # | X:    4 | Y:   -1 | Wheel:    0 
E: 000000.047877 4 00 04 ff 00
#  Button: 0  0  0  0  0 | # | X:    1 | Y:    0 | Wheel:    0 
E: 000000.055876 4 00 01 00 00
#  Button: 0  0  0  0  0 | # | X:    1 | Y:   -1 | Wheel:    0 
E: 000000.063877 4 00 01 ff 00
#  Button: 0  0  0  0  0 | # | X:    1 | Y:    0 | Wheel:    0 
E: 000000.071876 4 00 01 00 00
#  Button: 0  0  0  0  0 | # | X:    0 | Y:   -1 | Wheel:    0 
E: 000000.464026 4 00 00 ff 00
#  Button: 0  0  0  0  0 | # | X:   -1 | Y:   -2 | Wheel:    0 
E: 000000.976203 4 00 ff fe 00
#  Button: 0  0  0  0  0 | # | X:    0 | Y:   -2 | Wheel:    0 
E: 000000.984135 4 00 00 fe 00
#  Button: 0  0  0  0  0 | # | X:   -1 | Y:   -3 | Wheel:    0 
E: 000000.991923 4 00 ff fd 00
#  Button: 0  0  0  0  0 | # | X:   -2 | Y:   -5 | Wheel:    0 
E: 000000.999870 4 00 fe fb 00
#  Button: 0  0  0  0  0 | # | X:   -3 | Y:   -6 | Wheel:    0 
E: 000001.007868 4 00 fd fa 00
#  Button: 0  0  0  0  0 | # | X:   -4 | Y:   -5 | Wheel:    0 
E: 000001.015873 4 00 fc fb 00
#  Button: 0  0  0  0  0 | # | X:   -4 | Y:   -6 | Wheel:    0 
E: 000001.023871 4 00 fc fa 00
#  Button: 0  0  0  0  0 | # | X:   -5 | Y:   -6 | Wheel:    0 
E: 000001.032013 4 00 fb fa 00
#  Button: 0  0  0  0  0 | # | X:   -6 | Y:   -6 | Wheel:    0 
E: 000001.039884 4 00 fa fa 00
#  Button: 0  0  0  0  0 | # | X:   -5 | Y:   -5 | Wheel:    0 
E: 000001.047869 4 00 fb fb 00
#  Button: 0  0  0  0  0 | # | X:   -5 | Y:   -5 | Wheel:    0 
E: 000001.055984 4 00 fb fb 00
#  Button: 0  0  0  0  0 | # | X:   -4 | Y:   -4 | Wheel:    0 
E: 000001.063866 4 00 fc fc 00
#  Button: 0  0  0  0  0 | # | X:   -4 | Y:   -3 | Wheel:    0 
E: 000001.071848 4 00 fc fd 00
#  Button: 0  0  0  0  0 | # | X:   -3 | Y:   -3 | Wheel:    0 
E: 000001.079904 4 00 fd fd 00
#  Button: 0  0  0  0  0 | # | X:   -4 | Y:   -3 | Wheel:    0 
E: 000001.087864 4 00 fc fd 00
#  Button: 0  0  0  0  0 | # | X:   -3 | Y:   -3 | Wheel:    0 
E: 000001.095838 4 00 fd fd 00
#  Button: 0  0  0  0  0 | # | X:   -3 | Y:   -2 | Wheel:    0 
E: 000001.103884 4 00 fd fe 00
#  Button: 0  0  0  0  0 | # | X:   -3 | Y:   -1 | Wheel:    0 
E: 000001.111877 4 00 fd ff 00
#  Button: 0  0  0  0  0 | # | X:   -4 | Y:   -2 | Wheel:    0 
E: 000001.119892 4 00 fc fe 00
#  Button: 0  0  0  0  0 | # | X:   -3 | Y:   -1 | Wheel:    0 
E: 000001.127876 4 00 fd ff 00
#  Button: 0  0  0  0  0 | # | X:   -4 | Y:   -1 | Wheel:    0 
E: 000001.135882 4 00 fc ff 00
#  Button: 0  0  0  0  0 | # | X:   -4 | Y:    0 | Wheel:    0 
E: 000001.143857 4 00 fc 00 00
#  Button: 0  0  0  0  0 | # | X:   -5 | Y:    0 | Wheel:    0 
E: 000001.151827 4 00 fb 00 00
#  Button: 0  0  0  0  0 | # | X:   -5 | Y:    0 | Wheel:    0 
E: 000001.159833 4 00 fb 00 00
#  Button: 0  0  0  0  0 | # | X:   -5 | Y:    0 | Wheel:    0 
E: 000001.167840 4 00 fb 00 00
#  Button: 0  0  0  0  0 | # | X:   -5 | Y:    1 | Wheel:    0 
E: 000001.175860 4 00 fb 01 00
#  Button: 0  0  0  0  0 | # | X:   -4 | Y:    1 | Wheel:    0 
E: 000001.183839 4 00 fc 01 00
#  Button: 0  0  0  0  0 | # | X:   -3 | Y:    1 | Wheel:    0 
E: 000001.191963 4 00 fd 01 00
#  Button: 0  0  0  0  0 | # | X:   -2 | Y:    1 | Wheel:    0 
E: 000001.199888 4 00 fe 01 00
#  Button: 0  0  0  0  0 | # | X:   -2 | Y:    1 | Wheel:    0 
E: 000001.207995 4 00 fe 01 00
#  Button: 0  0  0  0  0 | # | X:   -1 | Y:    1 | Wheel:    0 
E: 000001.215852 4 00 ff 01 00
#  Button: 0  0  0  0  0 | # | X:   -2 | Y:    2 | Wheel:    0 
E: 000001.223877 4 00 fe 02 00
#  Button: 0  0  0  0  0 | # | X:   -1 | Y:    1 | Wheel:    0 
E: 000001.231870 4 00 ff 01 00
#  Button: 0  0  0  0  0 | # | X:   -1 | Y:    1 | Wheel:    0 
E: 000001.239834 4 00 ff 01 00
#  Button: 0  0  0  0  0 | # | X:   -1 | Y:    1 | Wheel:    0 
E: 000001.247854 4 00 ff 01 00
#  Button: 0  0  0  0  0 | # | X:    0 | Y:    2 | Wheel:    0 
E: 000001.287916 4 00 00 02 00
#  Button: 0  0  0  0  0 | # | X:    0 | Y:    2 | Wheel:    0 
E: 000001.295848 4 00 00 02 00
#  Button: 0  0  0  0  0 | # | X:    0 | Y:    1 | Wheel:    0 
E: 000001.303861 4 00 00 01 00
#  Button: 0  0  0  0  0 | # | X:    0 | Y:    1 | Wheel:    0 
E: 000001.311868 4 00 00 01 00
#  Button: 0  0  0  0  0 | # | X:    0 | Y:    1 | Wheel:    0 
E: 000001.319869 4 00 00 01 00
#  Button: 0  0  0  0  0 | # | X:    0 | Y:    1 | Wheel:    0 
E: 000001.327865 4 00 00 01 00
#  Button: 0  0  0  0  0 | # | X:    0 | Y:    2 | Wheel:    0 
E: 000001.335876 4 00 00 02 00
#  Button: 0  0  0  0  0 | # | X:    1 | Y:    2 | Wheel:    0 
E: 000001.343898 4 00 01 02 00
#  Button: 0  0  0  0  0 | # | X:    2 | Y:    1 | Wheel:    0 
E: 000001.367922 4 00 02 01 00
#  Button: 0  0  0  0  0 | # | X:    0 | Y:    2 | Wheel:    0 
E: 000001.663857 4 00 00 02 00
#  Button: 0  0  0  0  0 | # | X:    0 | Y:    3 | Wheel:    0 
E: 000001.671858 4 00 00 03 00
#  Button: 0  0  0  0  0 | # | X:    0 | Y:    2 | Wheel:    0 
E: 000001.679861 4 00 00 02 00
#  Button: 0  0  0  0  0 | # | X:    0 | Y:    5 | Wheel:    0 
E: 000001.687847 4 00 00 05 00
#  Button: 0  0  0  0  0 | # | X:    0 | Y:    5 | Wheel:    0 
E: 000001.695875 4 00 00 05 00
#  Button: 0  0  0  0  0 | # | X:    0 | Y:    5 | Wheel:    0 
E: 000001.703940 4 00 00 05 00
#  Button: 0  0  0  0  0 | # | X:    0 | Y:    4 | Wheel:    0 
E: 000001.711862 4 00 00 04 00
#  Button: 0  0  0  0  0 | # | X:    0 | Y:    5 | Wheel:    0 
E: 000001.719841 4 00 00 05 00
#  Button: 0  0  0  0  0 | # | X:    0 | Y:    1 | Wheel:    0 
E: 000001.727833 4 00 00 01 00
#  Button: 0  0  0  0  0 | # | X:    0 | Y:    2 | Wheel:    0 
E: 000001.735839 4 00 00 02 00
#  Button: 0  0  0  0  0 | # | X:    0 | Y:    3 | Wheel:    0 
E: 000001.743838 4 00 00 03 00
#  Button: 0  0  0  0  0 | # | X:    0 | Y:    3 | Wheel:    0 
E: 000001.751842 4 00 00 03 00
#  Button: 0  0  0  0  0 | # | X:    0 | Y:    3 | Wheel:    0 
E: 000001.759836 4 00 00 03 00
#  Button: 0  0  0  0  0 | # | X:    0 | Y:    4 | Wheel:    0 
E: 000001.767841 4 00 00 04 00
#  Button: 0  0  0  0  0 | # | X:    1 | Y:    3 | Wheel:    0 
E: 000001.775848 4 00 01 03 00
#  Button: 0  0  0  0  0 | # | X:    0 | Y:    3 | Wheel:    0 
E: 000001.783844 4 00 00 03 00
#  Button: 0  0  0  0  0 | # | X:    1 | Y:    4 | Wheel:    0 
E: 000001.791834 4 00 01 04 00
#  Button: 0  0  0  0  0 | # | X:    0 | Y:    3 | Wheel:    0 
E: 000001.799837 4 00 00 03 00
#  Button: 1  0  0  0  0 | # | X:    0 | Y:    0 | Wheel:    0 
E: 000001.951977 4 01 00 00 00
#  Button: 0  0  0  0  0 | # | X:    0 | Y:    0 | Wheel:    0 
E: 000001.959866 4 00 00 00 00
#  Button: 1  0  0  0  0 | # | X:    0 | Y:    0 | Wheel:    0 
E: 000003.039955 4 01 00 00 00
#  Button: 0  0  0  0  0 | # | X:    0 | Y:    0 | Wheel:    0 
E: 000003.047898 4 00 00 00 00
#  Button: 1  0  0  0  0 | # | X:    0 | Y:    0 | Wheel:    0 
E: 000003.927968 4 01 00 00 00
#  Button: 0  0  0  0  0 | # | X:    0 | Y:    0 | Wheel:    0 
E: 000003.936401 4 00 00 00 00
#  Button: 0  0  0  0  0 | # | X:    0 | Y:    2 | Wheel:    0 
E: 000006.343930 4 00 00 02 00
#  Button: 0  0  0  0  0 | # | X:    0 | Y:    3 | Wheel:    0 
E: 000006.351859 4 00 00 03 00
#  Button: 0  0  0  0  0 | # | X:   -2 | Y:    5 | Wheel:    0 
E: 000006.359864 4 00 fe 05 00
#  Button: 0  0  0  0  0 | # | X:   -3 | Y:    7 | Wheel:    0 
E: 000006.367841 4 00 fd 07 00
#  Button: 0  0  0  0  0 | # | X:   -4 | Y:    8 | Wheel:    0 
E: 000006.375851 4 00 fc 08 00
#  Button: 0  0  0  0  0 | # | X:   -4 | Y:    9 | Wheel:    0 
E: 000006.383861 4 00 fc 09 00
#  Button: 0  0  0  0  0 | # | X:   -4 | Y:    8 | Wheel:    0 
E: 000006.391866 4 00 fc 08 00
#  Button: 0  0  0  0  0 | # | X:   -2 | Y:    7 | Wheel:    0 
E: 000006.399856 4 00 fe 07 00
#  Button: 0  0  0  0  0 | # | X:   -1 | Y:    6 | Wheel:    0 
E: 000006.407883 4 00 ff 06 00
#  Button: 0  0  0  0  0 | # | X:   -1 | Y:    6 | Wheel:    0 
E: 000006.415881 4 00 ff 06 00
#  Button: 0  0  0  0  0 | # | X:    0 | Y:    6 | Wheel:    0 
E: 000006.423892 4 00 00 06 00
#  Button: 0  0  0  0  0 | # | X:    0 | Y:    6 | Wheel:    0 
E: 000006.431897 4 00 00 06 00
#  Button: 0  0  0  0  0 | # | X:    1 | Y:    6 | Wheel:    0 
E: 000006.439812 4 00 01 06 00
#  Button: 0  0  0  0  0 | # | X:    1 | Y:    6 | Wheel:    0 
E: 000006.447791 4 00 01 06 00
#  Button: 0  0  0  0  0 | # | X:    1 | Y:    7 | Wheel:    0 
E: 000006.455785 4 00 01 07 00
#  Button: 0  0  0  0  0 | # | X:    1 | Y:    6 | Wheel:    0 
E: 000006.463778 4 00 01 06 00
#  Button: 0  0  0  0  0 | # | X:    0 | Y:    6 | Wheel:    0 
E: 000006.471793 4 00 00 06 00
#  Button: 0  0  0  0  0 | # | X:    1 | Y:    5 | Wheel:    0 
E: 000006.479800 4 00 01 05 00
#  Button: 0  1  0  0  0 | # | X:    0 | Y:    0 | Wheel:    0 
E: 000007.936172 4 02 00 00 00
#  Button: 0  0  0  0  0 | # | X:    0 | Y:    0 | Wheel:    0 
E: 000007.943842 4 00 00 00 00
#  Button: 0  0  0  0  0 | # | X:    1 | Y:   -2 | Wheel:    0 
E: 000008.423899 4 00 01 fe 00
#  Button: 0  0  0  0  0 | # | X:    2 | Y:   -2 | Wheel:    0 
E: 000008.431861 4 00 02 fe 00
#  Button: 0  0  0  0  0 | # | X:    2 | Y:   -1 | Wheel:    0 
E: 000008.439857 4 00 02 ff 00
#  Button: 0  0  0  0  0 | # | X:    3 | Y:   -3 | Wheel:    0 
E: 000008.447887 4 00 03 fd 00
#  Button: 0  0  0  0  0 | # | X:    5 | Y:   -3 | Wheel:    0 
E: 000008.455784 4 00 05 fd 00
#  Button: 0  0  0  0  0 | # | X:    6 | Y:   -4 | Wheel:    0 
E: 000008.463797 4 00 06 fc 00
#  Button: 0  0  0  0  0 | # | X:    5 | Y:   -5 | Wheel:    0 
E: 000008.471791 4 00 05 fb 00
#  Button: 0  0  0  0  0 | # | X:    6 | Y:   -5 | Wheel:    0 
E: 000008.479772 4 00 06 fb 00
#  Button: 0  0  0  0  0 | # | X:    5 | Y:   -4 | Wheel:    0 
E: 000008.487788 4 00 05 fc 00
#  Button: 0  0  0  0  0 | # | X:    5 | Y:   -4 | Wheel:    0 
E: 000008.495784 4 00 05 fc 00
#  Button: 0  0  0  0  0 | # | X:    5 | Y:   -4 | Wheel:    0 
E: 000008.503783 4 00 05 fc 00
#  Button: 0  0  0  0  0 | # | X:    5 | Y:   -3 | Wheel:    0 
E: 000008.511855 4 00 05 fd 00
#  Button: 0  0  0  0  0 | # | X:    6 | Y:   -4 | Wheel:    0 
E: 000008.519792 4 00 06 fc 00
#  Button: 0  0  0  0  0 | # | X:    5 | Y:   -3 | Wheel:    0 
E: 000008.527844 4 00 05 fd 00
#  Button: 0  0  0  0  0 | # | X:    4 | Y:   -3 | Wheel:    0 
E: 000008.535782 4 00 04 fd 00
#  Button: 0  0  0  0  0 | # | X:    4 | Y:   -2 | Wheel:    0 
E: 000008.543788 4 00 04 fe 00
#  Button: 0  0  0  0  0 | # | X:    4 | Y:   -1 | Wheel:    0 
E: 000008.551794 4 00 04 ff 00
#  Button: 0  0  0  0  0 | # | X:    5 | Y:   -1 | Wheel:    0 
E: 000008.559785 4 00 05 ff 00
#  Button: 0  0  0  0  0 | # | X:    7 | Y:   -1 | Wheel:    0 
E: 000008.567789 4 00 07 ff 00
#  Button: 0  0  0  0  0 | # | X:    7 | Y:   -1 | Wheel:    0 
E: 000008.575785 4 00 07 ff 00
#  Button: 0  0  0  0  0 | # | X:    7 | Y:   -2 | Wheel:    0 
E: 000008.583789 4 00 07 fe 00
#  Button: 0  0  0  0  0 | # | X:    7 | Y:   -2 | Wheel:    0 
E: 000008.591852 4 00 07 fe 00
#  Button: 0  0  0  0  0 | # | X:    6 | Y:   -1 | Wheel:    0 
E: 000008.599793 4 00 06 ff 00
#  Button: 0  0  0  0  0 | # | X:    5 | Y:   -2 | Wheel:    0 
E: 000008.607781 4 00 05 fe 00
#  Button: 0  0  0  0  0 | # | X:    4 | Y:   -1 | Wheel:    0 
E: 000008.615768 4 00 04 ff 00
#  Button: 0  0  0  0  0 | # | X:    4 | Y:   -2 | Wheel:    0 
E: 000008.623774 4 00 04 fe 00
#  Button: 0  0  0  0  0 | # | X:    3 | Y:   -1 | Wheel:    0 
E: 000008.631776 4 00 03 ff 00
#  Button: 0  0  0  0  0 | # | X:    2 | Y:   -1 | Wheel:    0 
E: 000008.639783 4 00 02 ff 00
#  Button: 0  0  0  0  0 | # | X:    3 | Y:    0 | Wheel:    0 
E: 000008.647767 4 00 03 00 00
#  Button: 0  0  0  0  0 | # | X:    2 | Y:   -1 | Wheel:    0 
E: 000008.655804 4 00 02 ff 00
#  Button: 0  0  0  0  0 | # | X:    3 | Y:    0 | Wheel:    0 
E: 000008.663758 4 00 03 00 00
#  Button: 0  0  0  0  0 | # | X:    2 | Y:    0 | Wheel:    0 
E: 000008.671757 4 00 02 00 00
#  Button: 0  0  0  0  0 | # | X:    3 | Y:    0 | Wheel:    0 
E: 000008.679812 4 00 03 00 00
#  Button: 0  0  0  0  0 | # | X:    3 | Y:   -1 | Wheel:    0 
E: 000008.687760 4 00 03 ff 00
#  Button: 0  0  0  0  0 | # | X:    3 | Y:    0 | Wheel:    0 
E: 000008.695772 4 00 03 00 00
#  Button: 0  0  0  0  0 | # | X:    2 | Y:    0 | Wheel:    0 
E: 000008.703915 4 00 02 00 00
#  Button: 0  0  0  0  0 | # | X:    2 | Y:    0 | Wheel:    0 
E: 000008.711825 4 00 02 00 00
#  Button: 0  0  0  0  0 | # | X:    3 | Y:   -1 | Wheel:    0 
E: 000008.719825 4 00 03 ff 00
#  Button: 0  0  0  0  0 | # | X:    1 | Y:    0 | Wheel:    0 
E: 000008.744061 4 00 01 00 00
#  Button: 0  0  0  0  0 | # | X:    4 | Y:    0 | Wheel:    0 
E: 000009.312419 4 00 04 00 00
#  Button: 0  0  0  0  0 | # | X:    4 | Y:    0 | Wheel:    0 
E: 000009.320311 4 00 04 00 00
#  Button: 0  0  0  0  0 | # | X:    6 | Y:    0 | Wheel:    0 
E: 000009.328410 4 00 06 00 00
#  Button: 0  0  0  0  0 | # | X:    8 | Y:    0 | Wheel:    0 
E: 000009.335873 4 00 08 00 00
#  Button: 0  0  0  0  0 | # | X:    9 | Y:    0 | Wheel:    0 
E: 000009.344094 4 00 09 00 00
#  Button: 0  0  0  0  0 | # | X:    9 | Y:    1 | Wheel:    0 
E: 000009.351989 4 00 09 01 00
#  Button: 0  0  0  0  0 | # | X:    8 | Y:    0 | Wheel:    0 
E: 000009.359862 4 00 08 00 00
#  Button: 0  0  0  0  0 | # | X:    7 | Y:    0 | Wheel:    0 
E: 000009.367859 4 00 07 00 00
#  Button: 0  0  0  0  0 | # | X:    7 | Y:    0 | Wheel:    0 
E: 000009.375859 4 00 07 00 00
#  Button: 0  0  0  0  0 | # | X:    5 | Y:    0 | Wheel:    0 
E: 000009.384169 4 00 05 00 00
#  Button: 0  0  0  0  0 | # | X:    6 | Y:    0 | Wheel:    0 
E: 000009.392016 4 00 06 00 00
#  Button: 0  0  0  0  0 | # | X:    6 | Y:    0 | Wheel:    0 
E: 000009.399871 4 00 06 00 00
#  Button: 0  0  0  0  0 | # | X:    5 | Y:    0 | Wheel:    0 
E: 000009.407823 4 00 05 00 00
#  Button: 0  0  0  0  0 | # | X:    4 | Y:    0 | Wheel:    0 
E: 000009.416214 4 00 04 00 00
#  Button: 0  0  0  0  0 | # | X:    5 | Y:    0 | Wheel:    0 
E: 000009.423796 4 00 05 00 00
#  Button: 0  0  0  0  0 | # | X:    4 | Y:    0 | Wheel:    0 
E: 000009.431821 4 00 04 00 00
#  Button: 0  0  0  0  0 | # | X:    5 | Y:    0 | Wheel:    0 
E: 000009.439999 4 00 05 00 00
#  Button: 0  0  0  0  0 | # | X:    5 | Y:    0 | Wheel:    0 
E: 000009.447873 4 00 05 00 00
#  Button: 0  0  0  0  0 | # | X:    4 | Y:    1 | Wheel:    0 
E: 000009.455811 4 00 04 01 00
#  Button: 0  0  0  0  0 | # | X:    3 | Y:    0 | Wheel:    0 
E: 000009.463814 4 00 03 00 00
#  Button: 0  0  0  0  0 | # | X:    1 | Y:    0 | Wheel:    0 
E: 000009.471943 4 00 01 00 00
#  Button: 0  0  0  0  0 | # | X:    1 | Y:    1 | Wheel:    0 
E: 000009.480137 4 00 01 01 00
#  Button: 0  0  0  0  0 | # | X:    1 | Y:    0 | Wheel:    0 
E: 000009.487844 4 00 01 00 00
#  Button: 0  0  0  0  0 | # | X:    1 | Y:    0 | Wheel:    0 
E: 000009.495935 4 00 01 00 00
#  Button: 0  0  0  0  0 | # | X:    1 | Y:    0 | Wheel:    0 
E: 000009.631867 4 00 01 00 00
