edid-decode (hex):

00 ff ff ff ff ff ff 00 1e 04 d4 03 1e 00 00 00
1e 21 01 03 80 0f 09 78 0e ee 95 a3 54 4c 99 26
0f 4f 4f 00 00 00 01 01 01 01 01 01 01 01 01 01
01 01 01 01 01 01 af 7d 38 0e 41 80 42 70 5a 3c
e6 04 c4 8e 21 00 00 1e bb 35 38 60 40 80 1d 70
48 08 d3 00 ba 88 21 00 00 1e 00 00 00 fd 00 37
41 32 46 22 00 0a 20 20 20 20 20 20 00 00 00 fc
00 4d 49 4e 49 0a 20 20 20 20 20 20 20 20 01 d0

02 03 13 c0 40 23 09 04 01 83 00 00 00 65 03 0c
00 10 00 00 00 00 00 00 00 00 00 00 00 00 00 00
00 00 00 00 00 00 00 00 00 00 00 00 00 00 00 00
00 00 00 00 00 00 00 00 00 00 00 00 00 00 00 00
00 00 00 00 00 00 00 00 00 00 00 00 00 00 00 00
00 00 00 00 00 00 00 00 00 00 00 00 00 00 00 00
00 00 00 00 00 00 00 00 00 00 00 00 00 00 00 00
00 00 00 00 00 00 00 00 00 00 00 00 00 00 00 b0

----------------

Block 0, Base EDID:
  EDID Structure Version & Revision: 1.3
  Vendor & Product Identification:
    Manufacturer: GPD
    Model: 980
    Serial Number: 30 (0x0000001e)
    Made in: week 30 of 2023
  Basic Display Parameters & Features:
    Digital display
    Maximum image size: 15 cm x 9 cm
    Gamma: 2.20
    RGB color display
    Default (sRGB) color space is primary color space
    First detailed timing is the preferred timing
  Color Characteristics:
    Red  : 0.6396, 0.3300
    Green: 0.2998, 0.5996
    Blue : 0.1503, 0.0595
    White: 0.3095, 0.3095
  Established Timings I & II: none
  Standard Timings: none
  Detailed Timing Descriptors:
    DTD 1:  1080x1920  120.006714 Hz   9:16   238.333 kHz    321.750000 MHz (708 mm x 398 mm)
      Modeline "1080x1920_120.01" 321.750  1080 1170 1230 1350  1920 1950 1956 1986  +HSync +VSync
    DTD 2:  1080x1920   60.012461 Hz   9:16   116.964 kHz    137.550000 MHz (698 mm x 392 mm)
      Modeline "1080x1920_60.01" 137.550  1080 1152 1160 1176  1920 1933 1936 1949  +HSync +VSync
    Display Range Limits:
      Monitor ranges (GTF): 55-65 Hz V, 50-70 kHz H, max dotclock 340 MHz
    Display Product Name: 'MINI'
  Extension blocks: 1
Checksum: 0xd0

----------------

Block 1, CTA-861 Extension Block:
  Revision: 3
  Underscans IT Video Formats by default
  Basic audio support
  Native detailed modes: 0
  Video Data Block:
  Audio Data Block:
    Linear PCM:
      Max channels: 2
      Supported sample rates (kHz): 48
      Supported sample sizes (bits): 16
  Speaker Allocation Data Block:
  Vendor-Specific Data Block (HDMI), OUI 00-0C-03:
    Source physical address: 1.0.0.0
Checksum: 0xb0  Unused space in Extension Block: 108 bytes

----------------

Preferred Video Timing if only Block 0 is parsed:
  DTD   1:  1080x1920  120.006714 Hz   9:16   238.333 kHz    321.750000 MHz (708 mm x 398 mm)
    Modeline "1080x1920_120.01" 321.750  1080 1170 1230 1350  1920 1950 1956 1986  +HSync +VSync

----------------

Preferred Video Timing if Block 0 and CTA-861 Blocks are parsed:
  DTD   1:  1080x1920  120.006714 Hz   9:16   238.333 kHz    321.750000 MHz (708 mm x 398 mm)
    Modeline "1080x1920_120.01" 321.750  1080 1170 1230 1350  1920 1950 1956 1986  +HSync +VSync
