edid-decode (hex):

00 ff ff ff ff ff ff 00 07 21 0a 01 26 10 23 20
2c 21 01 04 a5 05 08 78 3a ef 65 a6 56 52 9d 28
0b 50 54 00 00 00 01 01 01 01 01 01 01 01 01 01
01 01 01 01 01 01 be 11 80 78 20 c0 24 30 28 28
04 04 4b 32 00 00 00 1e 00 00 00 10 00 00 00 00
00 00 00 00 00 00 00 00 00 00 00 00 00 10 00 00
00 00 00 00 00 00 00 00 00 00 00 00 00 00 00 fc
00 41 59 41 4e 45 4f 51 48 44 0a 20 20 20 01 6f

02 03 00 f2 40 23 09 7f 07 83 01 00 00 65 03 0c
00 10 00 00 00 00 00 00 00 00 00 00 00 00 00 00
00 00 00 00 00 00 00 00 00 00 00 00 00 00 00 00
00 00 00 00 00 00 00 00 00 00 00 00 00 00 00 00
00 00 00 00 00 00 00 00 00 00 00 00 00 00 00 00
00 00 00 00 00 00 00 00 00 00 00 00 00 00 00 00
00 00 00 00 00 00 00 00 00 00 00 00 00 00 00 00
00 00 00 00 00 00 00 00 00 00 00 00 00 00 00 0f

----------------

Block 0, Base EDID:
  EDID Structure Version & Revision: 1.4
  Vendor & Product Identification:
    Manufacturer: AYA
    Model: 266
    Serial Number: 539168806 (0x20231026)
    Made in: week 44 of 2023
  Basic Display Parameters & Features:
    Digital display
    Bits per primary color channel: 8
    DisplayPort interface
    Maximum image size: 5 cm x 8 cm
    Gamma: 2.20
    DPMS levels: Off
    Supported color formats: RGB 4:4:4, YCrCb 4:4:4, YCrCb 4:2:2
    First detailed timing includes the native pixel format and preferred refresh rate
  Color Characteristics:
    Red  : 0.6513, 0.3378
    Green: 0.3232, 0.6162
    Blue : 0.1572, 0.0449
    White: 0.3134, 0.3291
  Established Timings I & II: none
  Standard Timings: none
  Detailed Timing Descriptors:
    DTD 1:   640x960    60.003171 Hz   2:3     59.763 kHz     45.420000 MHz (75 mm x 50 mm)
      Modeline "640x960_60.00" 45.420  640 680 720 760  960 976 980 996  +HSync +VSync
    Dummy Descriptor:
    Dummy Descriptor:
    Display Product Name: 'AYANEOQHD'
  Extension blocks: 1
Checksum: 0x6f

----------------

Block 1, CTA-861 Extension Block:
  Revision: 3
  Underscans IT Video Formats by default
  Basic audio support
  Supports YCbCr 4:4:4
  Supports YCbCr 4:2:2
  Native detailed modes: 2
Checksum: 0x0f

----------------

Preferred Video Timing if only Block 0 is parsed:
  DTD   1:   640x960    60.003171 Hz   2:3     59.763 kHz     45.420000 MHz (75 mm x 50 mm)
    Modeline "640x960_60.00" 45.420  640 680 720 760  960 976 980 996  +HSync +VSync

----------------

Preferred Video Timing if Block 0 and CTA-861 Blocks are parsed:
  DTD   1:   640x960    60.003171 Hz   2:3     59.763 kHz     45.420000 MHz (75 mm x 50 mm)
    Modeline "640x960_60.00" 45.420  640 680 720 760  960 976 980 996  +HSync +VSync
