edid-decode (hex):

00 ff ff ff ff ff ff 00 09 e5 12 02 30 06 23 20
17 21 01 04 a5 09 0f 78 0e ee 95 a3 54 4c 99 26
0f 4f 4f 00 00 00 01 01 01 01 01 01 01 01 01 01
01 01 01 01 01 01 90 7e 38 18 41 80 42 70 58 2c
e6 04 9a 57 00 00 00 1e 00 00 00 10 00 00 00 00
00 00 00 00 00 00 00 00 00 00 00 00 00 10 00 00
00 00 00 00 00 00 00 00 00 00 00 00 00 00 00 fd
00 37 7d 32 46 22 00 0a 20 20 20 20 20 20 01 45

02 03 00 f1 41 00 23 09 04 01 83 01 00 00 65 03
0c 00 10 00 00 00 00 00 00 00 00 00 00 00 00 00
00 00 00 00 00 00 00 00 00 00 00 00 00 00 00 00
00 00 00 00 00 00 00 00 00 00 00 00 00 00 00 00
00 00 00 00 00 00 00 00 00 00 00 00 00 00 00 00
00 00 00 00 00 00 00 00 00 00 00 00 00 00 00 00
00 00 00 00 00 00 00 00 00 00 00 00 00 00 00 00
00 00 00 00 00 00 00 00 00 00 00 00 00 00 00 90

----------------

Block 0, Base EDID:
  EDID Structure Version & Revision: 1.4
  Vendor & Product Identification:
    Manufacturer: BOE
    Model: 530
    Serial Number: 539166256 (0x20230630)
    Made in: week 23 of 2023
  Basic Display Parameters & Features:
    Digital display
    Bits per primary color channel: 8
    DisplayPort interface
    Maximum image size: 9 cm x 15 cm
    Gamma: 2.20
    Supported color formats: RGB 4:4:4, YCrCb 4:4:4
    Default (sRGB) color space is primary color space
    First detailed timing includes the native pixel format and preferred refresh rate
  Color Characteristics:
    Red  : 0.6396, 0.3300
    Green: 0.2998, 0.5996
    Blue : 0.1503, 0.0595
    White: 0.3095, 0.3095
  Established Timings I & II: none
  Standard Timings: none
  Detailed Timing Descriptors:
    DTD 1:  1080x1920  119.957348 Hz   9:16   238.235 kHz    324.000000 MHz (154 mm x 87 mm)
      Modeline "1080x1920_119.96" 324.000  1080 1168 1212 1360  1920 1950 1956 1986  +HSync +VSync
    Dummy Descriptor:
    Dummy Descriptor:
    Display Range Limits:
      Monitor ranges (GTF): 55-125 Hz V, 50-70 kHz H, max dotclock 340 MHz
  Extension blocks: 1
Checksum: 0x45

----------------

Block 1, CTA-861 Extension Block:
  Revision: 3
  Underscans IT Video Formats by default
  Basic audio support
  Supports YCbCr 4:4:4
  Supports YCbCr 4:2:2
  Native detailed modes: 1
Checksum: 0x90

----------------

Preferred Video Timing if only Block 0 is parsed:
  DTD   1:  1080x1920  119.957348 Hz   9:16   238.235 kHz    324.000000 MHz (154 mm x 87 mm)
    Modeline "1080x1920_119.96" 324.000  1080 1168 1212 1360  1920 1950 1956 1986  +HSync +VSync

----------------

Preferred Video Timing if Block 0 and CTA-861 Blocks are parsed:
  DTD   1:  1080x1920  119.957348 Hz   9:16   238.235 kHz    324.000000 MHz (154 mm x 87 mm)
    Modeline "1080x1920_119.96" 324.000  1080 1168 1212 1360  1920 1950 1956 1986  +HSync +VSync
