edid-decode (hex):

00 ff ff ff ff ff ff 00 51 a1 27 20 00 00 00 00
1e 21 01 04 a5 10 08 78 07 6e a1 a4 52 4c 9a 25
0f 50 54 00 00 00 01 01 01 01 01 01 01 01 01 01
01 01 01 01 01 01 8b 6f 80 a0 70 38 40 40 30 20
62 0c 9b 57 00 00 00 18 c6 37 80 a0 70 38 40 40
30 20 62 0c 9b 57 00 00 00 1a 00 00 00 fd 00 30
78 8c 8c 1d 01 0a 20 20 20 20 20 20 00 00 00 fc
00 54 4c 30 37 30 46 56 58 53 30 32 2d 30 00 83

----------------

Block 0, Base EDID:
  EDID Structure Version & Revision: 1.4
  Vendor & Product Identification:
    Manufacturer: TMA
    Model: 8231
    Made in: week 30 of 2023
  Basic Display Parameters & Features:
    Digital display
    Bits per primary color channel: 8
    DisplayPort interface
    Maximum image size: 16 cm x 8 cm
    Gamma: 2.20
    Supported color formats: RGB 4:4:4
    Default (sRGB) color space is primary color space
    First detailed timing includes the native pixel format and preferred refresh rate
    Display supports continuous frequencies
  Color Characteristics:
    Red  : 0.6416, 0.3222
    Green: 0.2998, 0.6035
    Blue : 0.1464, 0.0605
    White: 0.3125, 0.3291
  Established Timings I & II: none
  Standard Timings: none
  Detailed Timing Descriptors:
    DTD 1:  1920x1080  120.003194 Hz  16:9    137.284 kHz    285.550000 MHz (155 mm x 87 mm)
      Modeline "1920x1080_120.00" 285.550  1920 1968 2000 2080  1080 1134 1136 1144  -HSync -VSync
    DTD 2:  1920x1080   60.003698 Hz  16:9     68.644 kHz    142.780000 MHz (155 mm x 87 mm)
      Modeline "1920x1080_60.00" 142.780  1920 1968 2000 2080  1080 1134 1136 1144  +HSync -VSync
    Display Range Limits:
      Monitor ranges (Range Limits Only): 48-120 Hz V, 140-140 kHz H, max dotclock 290 MHz
    Display Product Name: 'TL070FVXS02-0'
Checksum: 0x83

----------------

Preferred Video Timing if only Block 0 is parsed:
  DTD   1:  1920x1080  120.003194 Hz  16:9    137.284 kHz    285.550000 MHz (155 mm x 87 mm)
    Modeline "1920x1080_120.00" 285.550  1920 1968 2000 2080  1080 1134 1136 1144  -HSync -VSync
