# Valve Software Steam Controller
# 0x05, 0x01,                    // Usage Page (Generic Desktop)        0
# 0x09, 0x06,                    // Usage (Keyboard)                    2
# 0x95, 0x01,                    // Report Count (1)                    4
# 0xa1, 0x01,                    // Collection (Application)            6
# 0x85, 0x01,                    //  Report ID (1)                      8
# 0x05, 0x07,                    //  Usage Page (Keyboard)              10
# 0x19, 0xe0,                    //  Usage Minimum (224)                12
# 0x29, 0xe7,                    //  Usage Maximum (231)                14
# 0x15, 0x00,                    //  Logical Minimum (0)                16
# 0x25, 0x01,                    //  Logical Maximum (1)                18
# 0x75, 0x01,                    //  Report Size (1)                    20
# 0x95, 0x08,                    //  Report Count (8)                   22
# 0x81, 0x02,                    //  Input (Data,Var,Abs)               24
# 0x95, 0x01,                    //  Report Count (1)                   26
# 0x75, 0x08,                    //  Report Size (8)                    28
# 0x81, 0x01,                    //  Input (Cnst,Arr,Abs)               30
# 0x95, 0x05,                    //  Report Count (5)                   32
# 0x75, 0x01,                    //  Report Size (1)                    34
# 0x05, 0x08,                    //  Usage Page (LEDs)                  36
# 0x19, 0x01,                    //  Usage Minimum (1)                  38
# 0x29, 0x05,                    //  Usage Maximum (5)                  40
# 0x91, 0x02,                    //  Output (Data,Var,Abs)              42
# 0x95, 0x01,                    //  Report Count (1)                   44
# 0x75, 0x03,                    //  Report Size (3)                    46
# 0x91, 0x01,                    //  Output (Cnst,Arr,Abs)              48
# 0x95, 0x06,                    //  Report Count (6)                   50
# 0x75, 0x08,                    //  Report Size (8)                    52
# 0x15, 0x00,                    //  Logical Minimum (0)                54
# 0x25, 0x65,                    //  Logical Maximum (101)              56
# 0x05, 0x07,                    //  Usage Page (Keyboard)              58
# 0x19, 0x00,                    //  Usage Minimum (0)                  60
# 0x29, 0x65,                    //  Usage Maximum (101)                62
# 0x81, 0x00,                    //  Input (Data,Arr,Abs)               64
# 0xc0,                          // End Collection                      66
# 0x05, 0x01,                    // Usage Page (Generic Desktop)        67
# 0x09, 0x02,                    // Usage (Mouse)                       69
# 0xa1, 0x01,                    // Collection (Application)            71
# 0x85, 0x02,                    //  Report ID (2)                      73
# 0x09, 0x01,                    //  Usage (Pointer)                    75
# 0xa1, 0x00,                    //  Collection (Physical)              77
# 0x05, 0x09,                    //   Usage Page (Button)               79
# 0x19, 0x01,                    //   Usage Minimum (1)                 81
# 0x29, 0x05,                    //   Usage Maximum (5)                 83
# 0x15, 0x00,                    //   Logical Minimum (0)               85
# 0x25, 0x01,                    //   Logical Maximum (1)               87
# 0x95, 0x05,                    //   Report Count (5)                  89
# 0x75, 0x01,                    //   Report Size (1)                   91
# 0x81, 0x02,                    //   Input (Data,Var,Abs)              93
# 0x95, 0x01,                    //   Report Count (1)                  95
# 0x75, 0x03,                    //   Report Size (3)                   97
# 0x81, 0x01,                    //   Input (Cnst,Arr,Abs)              99
# 0x05, 0x01,                    //   Usage Page (Generic Desktop)      101
# 0x09, 0x30,                    //   Usage (X)                         103
# 0x09, 0x31,                    //   Usage (Y)                         105
# 0x09, 0x38,                    //   Usage (Wheel)                     107
# 0x15, 0x81,                    //   Logical Minimum (-127)            109
# 0x25, 0x7f,                    //   Logical Maximum (127)             111
# 0x75, 0x08,                    //   Report Size (8)                   113
# 0x95, 0x03,                    //   Report Count (3)                  115
# 0x81, 0x06,                    //   Input (Data,Var,Rel)              117
# 0xc0,                          //  End Collection                     119
# 0xc0,                          // End Collection                      120
# 
R: 121 05 01 09 06 95 01 a1 01 85 01 05 07 19 e0 29 e7 15 00 25 01 75 01 95 08 81 02 95 01 75 08 81 01 95 05 75 01 05 08 19 01 29 05 91 02 95 01 75 03 91 01 95 06 75 08 15 00 25 65 05 07 19 00 29 65 81 00 c0 05 01 09 02 a1 01 85 02 09 01 a1 00 05 09 19 01 29 05 15 00 25 01 95 05 75 01 81 02 95 01 75 03 81 01 05 01 09 30 09 31 09 38 15 81 25 7f 75 08 95 03 81 06 c0 c0
N: Valve Software Steam Controller
I: 3 28de 1142
