edid-decode (hex):

00 ff ff ff ff ff ff 00 07 21 06 01 07 06 21 20
1b 21 01 03 80 0b 13 78 aa b0 65 a6 56 53 9d 28
0c 50 54 00 00 00 01 01 01 01 01 01 01 01 01 01
01 01 01 01 01 01 7e 6b 40 a4 60 00 28 a0 44 08
80 01 71 b5 00 00 00 1e 55 1d 20 a0 30 00 2e 50
20 0a a0 01 71 b5 00 00 00 1e 99 3d b0 a4 40 80
18 70 44 08 c4 00 71 b5 00 00 00 1a 00 00 00 fc
00 41 59 41 4e 45 4f 20 32 4b 0a 20 20 20 01 28

02 03 10 15 d0 50 20 00 2e 50 20 0a a0 01 71 b5
ba 2c 1a a0 40 90 28 60 40 08 84 01 71 b5 00 00
00 1e 4a 29 84 8c 30 40 38 60 30 0a a8 01 71 b5
00 00 00 1e 96 37 38 a8 40 80 44 70 28 08 80 01
71 b5 00 00 00 1e da 1b d0 8c 20 00 28 50 40 08
a0 01 71 b5 00 00 00 1e 74 31 b0 94 40 40 30 60
38 08 80 01 71 b5 00 00 00 1e 00 00 00 00 00 00
00 00 00 00 00 00 00 00 00 00 00 00 00 00 00 42

----------------

Block 0, Base EDID:
  EDID Structure Version & Revision: 1.3
  Vendor & Product Identification:
    Manufacturer: AYA
    Model: 262
    Serial Number: 539035143 (0x20210607)
    Made in: week 27 of 2023
  Basic Display Parameters & Features:
    Digital display
    Maximum image size: 11 cm x 19 cm
    Gamma: 2.20
    DPMS levels: Standby Off
    RGB color display
    First detailed timing is the preferred timing
  Color Characteristics:
    Red  : 0.6503, 0.3388
    Green: 0.3242, 0.6132
    Blue : 0.1572, 0.0488
    White: 0.3134, 0.3291
  Established Timings I & II: none
  Standard Timings: none
  Detailed Timing Descriptors:
    DTD 1:  1600x2560   59.999128 Hz   5:8    155.998 kHz    275.180000 MHz (113 mm x 181 mm)
      Modeline "1600x2560_60.00" 275.180  1600 1668 1676 1764  2560 2568 2584 2600  +HSync +VSync
    DTD 2:   800x1280   58.988499 Hz   5:8     78.219 kHz     75.090000 MHz (113 mm x 181 mm)
      Modeline "800x1280_58.99" 75.090  800 832 842 960  1280 1290 1306 1326  +HSync +VSync
    DTD 3:  1200x1920   59.469395 Hz   5:8    115.609 kHz    157.690000 MHz (113 mm x 181 mm)
      Modeline "1200x1920_59.47" 157.690  1200 1268 1276 1364  1920 1932 1936 1944  +HSync -VSync
    Display Product Name: 'AYANEO 2K'
  Extension blocks: 1
Checksum: 0x28

----------------

Block 1, CTA-861 Extension Block:
  Revision: 3
  Supports YCbCr 4:2:2
  Native detailed modes: 5
  Video Format Data Block:
    NTSC fractional frame rates are preferred
    RID 16@24p:  5120x2880   24.000000 Hz  64:27    88.200 kHz    465.696000 MHz
    RID 16@30p:  5120x2880   30.000000 Hz  64:27    88.200 kHz    465.696000 MHz
    RID 16@60p:  5120x2880   60.000000 Hz  64:27   178.800 kHz    951.216000 MHz
    RID 10@30p:  5120x1440   30.000000 Hz  32:9     44.400 kHz    236.208000 MHz
    RID 10@60p:  5120x1440   60.000000 Hz  32:9     90.000 kHz    472.320000 MHz
    RID 1@30p:  1280x720    30.000000 Hz  16:9     22.200 kHz     35.520000 MHz
    RID 1@60p:  1280x720    60.000000 Hz  16:9     45.600 kHz     67.488000 MHz
    RID 26@30p: 15360x8640   30.000000 Hz  16:9    263.400 kHz   4087.968000 MHz
    RID 26@60p: 15360x8640   60.000000 Hz  16:9    534.000 kHz   8270.592000 MHz
  Detailed Timing Descriptors:
    DTD 4:  1050x1680   55.016337 Hz   5:8     94.628 kHz    114.500000 MHz (113 mm x 181 mm)
      Modeline "1050x1680_55.02" 114.500  1050 1114 1122 1210  1680 1688 1708 1720  +HSync +VSync
    DTD 5:   900x1600   61.373560 Hz   9:16   101.635 kHz    105.700000 MHz (113 mm x 181 mm)
      Modeline "900x1600_61.37" 105.700  900 948 958 1040  1600 1610 1634 1656  +HSync +VSync
    DTD 6:  1080x1920   57.355350 Hz   9:16   114.022 kHz    142.300000 MHz (113 mm x 181 mm)
      Modeline "1080x1920_57.36" 142.300  1080 1120 1128 1248  1920 1928 1944 1988  +HSync +VSync
    DTD 7:   720x1280   62.808316 Hz   9:16    82.907 kHz     71.300000 MHz (113 mm x 181 mm)
      Modeline "720x1280_62.81" 71.300  720 784 792 860  1280 1290 1306 1320  +HSync +VSync
    DTD 8:  1200x1600   56.988419 Hz   3:4     93.917 kHz    126.600000 MHz (113 mm x 181 mm)
      Modeline "1200x1600_56.99" 126.600  1200 1256 1264 1348  1600 1608 1624 1648  +HSync +VSync
Checksum: 0x42  Unused space in Extension Block: 21 bytes

----------------

Preferred Video Timing if only Block 0 is parsed:
  DTD   1:  1600x2560   59.999128 Hz   5:8    155.998 kHz    275.180000 MHz (113 mm x 181 mm)
    Modeline "1600x2560_60.00" 275.180  1600 1668 1676 1764  2560 2568 2584 2600  +HSync +VSync

----------------

Preferred Video Timing if Block 0 and CTA-861 Blocks are parsed:
  DTD   1:  1600x2560   59.999128 Hz   5:8    155.998 kHz    275.180000 MHz (113 mm x 181 mm)
    Modeline "1600x2560_60.00" 275.180  1600 1668 1676 1764  2560 2568 2584 2600  +HSync +VSync
