# wch.cn Legion Go S
# 0x05, 0x01,                    // Usage Page (Generic Desktop)        0
# 0x09, 0x02,                    // Usage (Mouse)                       2
# 0xa1, 0x01,                    // Collection (Application)            4
# 0x85, 0x01,                    //  Report ID (1)                      6
# 0x09, 0x01,                    //  Usage (Pointer)                    8
# 0xa1, 0x00,                    //  Collection (Physical)              10
# 0x05, 0x09,                    //   Usage Page (Button)               12
# 0x19, 0x01,                    //   Usage Minimum (1)                 14
# 0x29, 0x08,                    //   Usage Maximum (8)                 16
# 0x15, 0x00,                    //   Logical Minimum (0)               18
# 0x25, 0x01,                    //   Logical Maximum (1)               20
# 0x75, 0x01,                    //   Report Size (1)                   22
# 0x95, 0x08,                    //   Report Count (8)                  24
# 0x81, 0x02,                    //   Input (Data,Var,Abs)              26
# 0x05, 0x01,                    //   Usage Page (Generic Desktop)      28
# 0x09, 0x30,                    //   Usage (X)                         30
# 0x09, 0x31,                    //   Usage (Y)                         32
# 0x09, 0x38,                    //   Usage (Wheel)                     34
# 0x15, 0x81,                    //   Logical Minimum (-127)            36
# 0x25, 0x7f,                    //   Logical Maximum (127)             38
# 0x75, 0x08,                    //   Report Size (8)                   40
# 0x95, 0x03,                    //   Report Count (3)                  42
# 0x81, 0x06,                    //   Input (Data,Var,Rel)              44
# 0xc0,                          //  End Collection                     46
# 0xc0,                          // End Collection                      47
# 0x05, 0x01,                    // Usage Page (Generic Desktop)        48
# 0x09, 0x06,                    // Usage (Keyboard)                    50
# 0xa1, 0x01,                    // Collection (Application)            52
# 0x85, 0x02,                    //  Report ID (2)                      54
# 0x05, 0x07,                    //  Usage Page (Keyboard)              56
# 0x19, 0x04,                    //  Usage Minimum (4)                  58
# 0x29, 0x70,                    //  Usage Maximum (112)                60
# 0x15, 0x00,                    //  Logical Minimum (0)                62
# 0x25, 0x01,                    //  Logical Maximum (1)                64
# 0x75, 0x01,                    //  Report Size (1)                    66
# 0x95, 0x78,                    //  Report Count (120)                 68
# 0x81, 0x02,                    //  Input (Data,Var,Abs)               70
# 0xc0,                          // End Collection                      72
# 0x05, 0x0c,                    // Usage Page (Consumer Devices)       73
# 0x09, 0x01,                    // Usage (Consumer Control)            75
# 0xa1, 0x01,                    // Collection (Application)            77
# 0x85, 0x03,                    //  Report ID (3)                      79
# 0x15, 0x00,                    //  Logical Minimum (0)                81
# 0x26, 0x3c, 0x04,              //  Logical Maximum (1084)             83
# 0x19, 0x00,                    //  Usage Minimum (0)                  86
# 0x2a, 0x14, 0x05,              //  Usage Maximum (1300)               88
# 0x95, 0x01,                    //  Report Count (1)                   91
# 0x75, 0x10,                    //  Report Size (16)                   93
# 0x81, 0x00,                    //  Input (Data,Arr,Abs)               95
# 0xc0,                          // End Collection                      97
# 0x06, 0xa0, 0xff,              // Usage Page (Vendor Usage Page 0xffa0) 98
# 0x09, 0x01,                    // Usage (Vendor Usage 0x01)           101
# 0xa1, 0x01,                    // Collection (Application)            103
# 0x85, 0x04,                    //  Report ID (4)                      105
# 0x09, 0x01,                    //  Usage (Vendor Usage 0x01)          107
# 0x15, 0x00,                    //  Logical Minimum (0)                109
# 0x26, 0xff, 0x00,              //  Logical Maximum (255)              111
# 0x75, 0x08,                    //  Report Size (8)                    114
# 0x95, 0x08,                    //  Report Count (8)                   116
# 0x81, 0x02,                    //  Input (Data,Var,Abs)               118
# 0x09, 0x02,                    //  Usage (Vendor Usage 0x02)          120
# 0x75, 0x08,                    //  Report Size (8)                    122
# 0x95, 0x08,                    //  Report Count (8)                   124
# 0x91, 0x02,                    //  Output (Data,Var,Abs)              126
# 0xc0,                          // End Collection                      128
# 0x06, 0x01, 0xff,              // Usage Page (Vendor Usage Page 0xff01) 129
# 0x09, 0xd6,                    // Usage (Vendor Usage 0xd6)           132
# 0xa1, 0x01,                    // Collection (Application)            134
# 0x85, 0x1c,                    //  Report ID (28)                     136
# 0x15, 0x00,                    //  Logical Minimum (0)                138
# 0x26, 0xff, 0x00,              //  Logical Maximum (255)              140
# 0x19, 0x01,                    //  Usage Minimum (1)                  143
# 0x29, 0x02,                    //  Usage Maximum (2)                  145
# 0x75, 0x08,                    //  Report Size (8)                    147
# 0x96, 0x97, 0x00,              //  Report Count (151)                 149
# 0xb1, 0x02,                    //  Feature (Data,Var,Abs)             152
# 0xc0,                          // End Collection                      154
# 
R: 155 05 01 09 02 a1 01 85 01 09 01 a1 00 05 09 19 01 29 08 15 00 25 01 75 01 95 08 81 02 05 01 09 30 09 31 09 38 15 81 25 7f 75 08 95 03 81 06 c0 c0 05 01 09 06 a1 01 85 02 05 07 19 04 29 70 15 00 25 01 75 01 95 78 81 02 c0 05 0c 09 01 a1 01 85 03 15 00 26 3c 04 19 00 2a 14 05 95 01 75 10 81 00 c0 06 a0 ff 09 01 a1 01 85 04 09 01 15 00 26 ff 00 75 08 95 08 81 02 09 02 75 08 95 08 91 02 c0 06 01 ff 09 d6 a1 01 85 1c 15 00 26 ff 00 19 01 29 02 75 08 96 97 00 b1 02 c0
N: wch.cn Legion Go S
I: 3 1a86 e311
# ReportID: 1 / Button: 0  0  0  0  0  0  0  0 | X:    0 | Y:    0 | Wheel:    0 
E: 000000.000000 5 01 00 00 00 00
# ReportID: 1 / Button: 0  0  0  0  0  0  0  0 | X:    0 | Y:    0 | Wheel:    0 
E: 000000.087025 5 01 00 00 00 00
# ReportID: 1 / Button: 0  0  0  0  0  0  0  0 | X:    4 | Y:   -4 | Wheel:    0 
E: 000000.095042 5 01 00 04 fc 00
# ReportID: 1 / Button: 0  0  0  0  0  0  0  0 | X:    4 | Y:   -3 | Wheel:    0 
E: 000000.102964 5 01 00 04 fd 00
# ReportID: 1 / Button: 0  0  0  0  0  0  0  0 | X:    7 | Y:   -2 | Wheel:    0 
E: 000000.110992 5 01 00 07 fe 00
# ReportID: 1 / Button: 0  0  0  0  0  0  0  0 | X:    7 | Y:   -2 | Wheel:    0 
E: 000000.119006 5 01 00 07 fe 00
# ReportID: 1 / Button: 0  0  0  0  0  0  0  0 | X:    8 | Y:   -1 | Wheel:    0 
E: 000000.127017 5 01 00 08 ff 00
# ReportID: 1 / Button: 0  0  0  0  0  0  0  0 | X:    8 | Y:   -1 | Wheel:    0 
E: 000000.135007 5 01 00 08 ff 00
# ReportID: 1 / Button: 0  0  0  0  0  0  0  0 | X:    8 | Y:    0 | Wheel:    0 
E: 000000.144011 5 01 00 08 00 00
# ReportID: 1 / Button: 0  0  0  0  0  0  0  0 | X:    8 | Y:    1 | Wheel:    0 
E: 000000.152001 5 01 00 08 01 00
# ReportID: 1 / Button: 0  0  0  0  0  0  0  0 | X:   10 | Y:    3 | Wheel:    0 
E: 000000.160053 5 01 00 0a 03 00
# ReportID: 1 / Button: 0  0  0  0  0  0  0  0 | X:    9 | Y:    3 | Wheel:    0 
E: 000000.167970 5 01 00 09 03 00
# ReportID: 1 / Button: 0  0  0  0  0  0  0  0 | X:    8 | Y:    4 | Wheel:    0 
E: 000000.176006 5 01 00 08 04 00
# ReportID: 1 / Button: 0  0  0  0  0  0  0  0 | X:    9 | Y:    6 | Wheel:    0 
E: 000000.184071 5 01 00 09 06 00
# ReportID: 1 / Button: 0  0  0  0  0  0  0  0 | X:    8 | Y:    6 | Wheel:    0 
E: 000000.192988 5 01 00 08 06 00
# ReportID: 1 / Button: 0  0  0  0  0  0  0  0 | X:    6 | Y:    7 | Wheel:    0 
E: 000000.201071 5 01 00 06 07 00
# ReportID: 1 / Button: 0  0  0  0  0  0  0  0 | X:    3 | Y:    8 | Wheel:    0 
E: 000000.209039 5 01 00 03 08 00
# ReportID: 1 / Button: 0  0  0  0  0  0  0  0 | X:    2 | Y:    8 | Wheel:    0 
E: 000000.216987 5 01 00 02 08 00
# ReportID: 1 / Button: 0  0  0  0  0  0  0  0 | X:    1 | Y:    7 | Wheel:    0 
E: 000000.224991 5 01 00 01 07 00
# ReportID: 1 / Button: 0  0  0  0  0  0  0  0 | X:    0 | Y:    8 | Wheel:    0 
E: 000000.233000 5 01 00 00 08 00
# ReportID: 1 / Button: 0  0  0  0  0  0  0  0 | X:   -2 | Y:    6 | Wheel:    0 
E: 000000.241995 5 01 00 fe 06 00
# ReportID: 1 / Button: 0  0  0  0  0  0  0  0 | X:   -7 | Y:    6 | Wheel:    0 
E: 000000.250077 5 01 00 f9 06 00
# ReportID: 1 / Button: 0  0  0  0  0  0  0  0 | X:  -11 | Y:    4 | Wheel:    0 
E: 000000.257958 5 01 00 f5 04 00
# ReportID: 1 / Button: 0  0  0  0  0  0  0  0 | X:  -11 | Y:    3 | Wheel:    0 
E: 000000.265998 5 01 00 f5 03 00
# ReportID: 1 / Button: 0  0  0  0  0  0  0  0 | X:  -11 | Y:    2 | Wheel:    0 
E: 000000.274033 5 01 00 f5 02 00
# ReportID: 1 / Button: 0  0  0  0  0  0  0  0 | X:  -10 | Y:    1 | Wheel:    0 
E: 000000.282018 5 01 00 f6 01 00
# ReportID: 1 / Button: 0  0  0  0  0  0  0  0 | X:  -10 | Y:    0 | Wheel:    0 
E: 000000.291088 5 01 00 f6 00 00
# ReportID: 1 / Button: 0  0  0  0  0  0  0  0 | X:  -11 | Y:    0 | Wheel:    0 
E: 000000.299009 5 01 00 f5 00 00
# ReportID: 1 / Button: 0  0  0  0  0  0  0  0 | X:  -10 | Y:   -3 | Wheel:    0 
E: 000000.306978 5 01 00 f6 fd 00
# ReportID: 1 / Button: 0  0  0  0  0  0  0  0 | X:   -8 | Y:   -4 | Wheel:    0 
E: 000000.314991 5 01 00 f8 fc 00
# ReportID: 1 / Button: 0  0  0  0  0  0  0  0 | X:   -8 | Y:   -6 | Wheel:    0 
E: 000000.323071 5 01 00 f8 fa 00
# ReportID: 1 / Button: 0  0  0  0  0  0  0  0 | X:   -6 | Y:   -7 | Wheel:    0 
E: 000000.330992 5 01 00 fa f9 00
# ReportID: 1 / Button: 0  0  0  0  0  0  0  0 | X:   -3 | Y:   -8 | Wheel:    0 
E: 000000.339034 5 01 00 fd f8 00
# ReportID: 1 / Button: 0  0  0  0  0  0  0  0 | X:   -2 | Y:   -8 | Wheel:    0 
E: 000000.348070 5 01 00 fe f8 00
# ReportID: 1 / Button: 0  0  0  0  0  0  0  0 | X:   -1 | Y:   -9 | Wheel:    0 
E: 000000.355977 5 01 00 ff f7 00
# ReportID: 1 / Button: 0  0  0  0  0  0  0  0 | X:    0 | Y:   -9 | Wheel:    0 
E: 000000.364004 5 01 00 00 f7 00
# ReportID: 1 / Button: 0  0  0  0  0  0  0  0 | X:    0 | Y:   -8 | Wheel:    0 
E: 000000.371969 5 01 00 00 f8 00
# ReportID: 1 / Button: 0  0  0  0  0  0  0  0 | X:    0 | Y:   -8 | Wheel:    0 
E: 000000.379997 5 01 00 00 f8 00
# ReportID: 1 / Button: 0  0  0  0  0  0  0  0 | X:    2 | Y:   -8 | Wheel:    0 
E: 000000.389063 5 01 00 02 f8 00
# ReportID: 1 / Button: 0  0  0  0  0  0  0  0 | X:    2 | Y:   -7 | Wheel:    0 
E: 000000.397013 5 01 00 02 f9 00
# ReportID: 1 / Button: 0  0  0  0  0  0  0  0 | X:    6 | Y:   -6 | Wheel:    0 
E: 000000.405033 5 01 00 06 fa 00
# ReportID: 1 / Button: 0  0  0  0  0  0  0  0 | X:    6 | Y:   -4 | Wheel:    0 
E: 000000.412994 5 01 00 06 fc 00
# ReportID: 1 / Button: 0  0  0  0  0  0  0  0 | X:    9 | Y:   -4 | Wheel:    0 
E: 000000.420977 5 01 00 09 fc 00
# ReportID: 1 / Button: 0  0  0  0  0  0  0  0 | X:    8 | Y:   -3 | Wheel:    0 
E: 000000.428989 5 01 00 08 fd 00
# ReportID: 1 / Button: 0  0  0  0  0  0  0  0 | X:   11 | Y:   -2 | Wheel:    0 
E: 000000.437041 5 01 00 0b fe 00
# ReportID: 1 / Button: 0  0  0  0  0  0  0  0 | X:   11 | Y:   -1 | Wheel:    0 
E: 000000.446051 5 01 00 0b ff 00
# ReportID: 1 / Button: 0  0  0  0  0  0  0  0 | X:   10 | Y:   -1 | Wheel:    0 
E: 000000.454046 5 01 00 0a ff 00
# ReportID: 1 / Button: 0  0  0  0  0  0  0  0 | X:   11 | Y:    0 | Wheel:    0 
E: 000000.462013 5 01 00 0b 00 00
# ReportID: 1 / Button: 0  0  0  0  0  0  0  0 | X:   10 | Y:    0 | Wheel:    0 
E: 000000.469953 5 01 00 0a 00 00
# ReportID: 1 / Button: 0  0  0  0  0  0  0  0 | X:   10 | Y:    1 | Wheel:    0 
E: 000000.477959 5 01 00 0a 01 00
# ReportID: 1 / Button: 0  0  0  0  0  0  0  0 | X:    8 | Y:    3 | Wheel:    0 
E: 000000.485971 5 01 00 08 03 00
# ReportID: 1 / Button: 0  0  0  0  0  0  0  0 | X:    8 | Y:    6 | Wheel:    0 
E: 000000.495015 5 01 00 08 06 00
# ReportID: 1 / Button: 0  0  0  0  0  0  0  0 | X:    8 | Y:    7 | Wheel:    0 
E: 000000.502961 5 01 00 08 07 00
# ReportID: 1 / Button: 0  0  0  0  0  0  0  0 | X:    7 | Y:    7 | Wheel:    0 
E: 000000.510965 5 01 00 07 07 00
# ReportID: 1 / Button: 0  0  0  0  0  0  0  0 | X:    3 | Y:    8 | Wheel:    0 
E: 000000.519009 5 01 00 03 08 00
# ReportID: 1 / Button: 0  0  0  0  0  0  0  0 | X:    1 | Y:   10 | Wheel:    0 
E: 000000.526979 5 01 00 01 0a 00
# ReportID: 1 / Button: 0  0  0  0  0  0  0  0 | X:    1 | Y:   11 | Wheel:    0 
E: 000000.534974 5 01 00 01 0b 00
# ReportID: 1 / Button: 0  0  0  0  0  0  0  0 | X:    0 | Y:    9 | Wheel:    0 
E: 000000.543007 5 01 00 00 09 00
# ReportID: 1 / Button: 0  0  0  0  0  0  0  0 | X:   -1 | Y:   10 | Wheel:    0 
E: 000000.551961 5 01 00 ff 0a 00
# ReportID: 1 / Button: 0  0  0  0  0  0  0  0 | X:   -3 | Y:    8 | Wheel:    0 
E: 000000.560008 5 01 00 fd 08 00
# ReportID: 1 / Button: 0  0  0  0  0  0  0  0 | X:   -6 | Y:    8 | Wheel:    0 
E: 000000.568029 5 01 00 fa 08 00
# ReportID: 1 / Button: 0  0  0  0  0  0  0  0 | X:   -7 | Y:    7 | Wheel:    0 
E: 000000.575977 5 01 00 f9 07 00
# ReportID: 1 / Button: 0  0  0  0  0  0  0  0 | X:  -10 | Y:    7 | Wheel:    0 
E: 000000.584027 5 01 00 f6 07 00
# ReportID: 1 / Button: 0  0  0  0  0  0  0  0 | X:  -12 | Y:    4 | Wheel:    0 
E: 000000.592084 5 01 00 f4 04 00
# ReportID: 1 / Button: 0  0  0  0  0  0  0  0 | X:  -12 | Y:    4 | Wheel:    0 
E: 000000.601005 5 01 00 f4 04 00
# ReportID: 1 / Button: 0  0  0  0  0  0  0  0 | X:  -11 | Y:    2 | Wheel:    0 
E: 000000.609023 5 01 00 f5 02 00
# ReportID: 1 / Button: 0  0  0  0  0  0  0  0 | X:  -10 | Y:    1 | Wheel:    0 
E: 000000.616986 5 01 00 f6 01 00
# ReportID: 1 / Button: 0  0  0  0  0  0  0  0 | X:  -10 | Y:    1 | Wheel:    0 
E: 000000.624963 5 01 00 f6 01 00
# ReportID: 1 / Button: 0  0  0  0  0  0  0  0 | X:   -9 | Y:    0 | Wheel:    0 
E: 000000.632985 5 01 00 f7 00 00
# ReportID: 1 / Button: 0  0  0  0  0  0  0  0 | X:   -9 | Y:   -1 | Wheel:    0 
E: 000000.641047 5 01 00 f7 ff 00
# ReportID: 1 / Button: 0  0  0  0  0  0  0  0 | X:   -7 | Y:   -4 | Wheel:    0 
E: 000000.649979 5 01 00 f9 fc 00
# ReportID: 1 / Button: 0  0  0  0  0  0  0  0 | X:   -7 | Y:   -6 | Wheel:    0 
E: 000000.657972 5 01 00 f9 fa 00
# ReportID: 1 / Button: 0  0  0  0  0  0  0  0 | X:   -2 | Y:   -8 | Wheel:    0 
E: 000000.665994 5 01 00 fe f8 00
# ReportID: 1 / Button: 0  0  0  0  0  0  0  0 | X:   -2 | Y:   -8 | Wheel:    0 
E: 000000.673961 5 01 00 fe f8 00
# ReportID: 1 / Button: 0  0  0  0  0  0  0  0 | X:   -1 | Y:  -10 | Wheel:    0 
E: 000000.682011 5 01 00 ff f6 00
# ReportID: 1 / Button: 0  0  0  0  0  0  0  0 | X:    0 | Y:   -9 | Wheel:    0 
E: 000000.690011 5 01 00 00 f7 00
# ReportID: 1 / Button: 0  0  0  0  0  0  0  0 | X:    0 | Y:  -10 | Wheel:    0 
E: 000000.699002 5 01 00 00 f6 00
# ReportID: 1 / Button: 0  0  0  0  0  0  0  0 | X:    1 | Y:   -9 | Wheel:    0 
E: 000000.707129 5 01 00 01 f7 00
# ReportID: 1 / Button: 0  0  0  0  0  0  0  0 | X:    2 | Y:   -8 | Wheel:    0 
E: 000000.715050 5 01 00 02 f8 00
# ReportID: 1 / Button: 0  0  0  0  0  0  0  0 | X:    3 | Y:   -8 | Wheel:    0 
E: 000000.723130 5 01 00 03 f8 00
# ReportID: 1 / Button: 0  0  0  0  0  0  0  0 | X:    4 | Y:   -7 | Wheel:    0 
E: 000000.730989 5 01 00 04 f9 00
# ReportID: 1 / Button: 0  0  0  0  0  0  0  0 | X:    6 | Y:   -6 | Wheel:    0 
E: 000000.739060 5 01 00 06 fa 00
# ReportID: 1 / Button: 0  0  0  0  0  0  0  0 | X:    8 | Y:   -4 | Wheel:    0 
E: 000000.748076 5 01 00 08 fc 00
# ReportID: 1 / Button: 0  0  0  0  0  0  0  0 | X:    9 | Y:   -4 | Wheel:    0 
E: 000000.755986 5 01 00 09 fc 00
# ReportID: 1 / Button: 0  0  0  0  0  0  0  0 | X:   10 | Y:   -2 | Wheel:    0 
E: 000000.764027 5 01 00 0a fe 00
# ReportID: 1 / Button: 0  0  0  0  0  0  0  0 | X:   10 | Y:   -1 | Wheel:    0 
E: 000000.772125 5 01 00 0a ff 00
# ReportID: 1 / Button: 0  0  0  0  0  0  0  0 | X:   10 | Y:   -1 | Wheel:    0 
E: 000000.780023 5 01 00 0a ff 00
# ReportID: 1 / Button: 0  0  0  0  0  0  0  0 | X:   12 | Y:    0 | Wheel:    0 
E: 000000.788035 5 01 00 0c 00 00
# ReportID: 1 / Button: 0  0  0  0  0  0  0  0 | X:   10 | Y:    1 | Wheel:    0 
E: 000000.797017 5 01 00 0a 01 00
# ReportID: 1 / Button: 0  0  0  0  0  0  0  0 | X:   11 | Y:    2 | Wheel:    0 
E: 000000.804982 5 01 00 0b 02 00
# ReportID: 1 / Button: 0  0  0  0  0  0  0  0 | X:   11 | Y:    4 | Wheel:    0 
E: 000000.813011 5 01 00 0b 04 00
# ReportID: 1 / Button: 0  0  0  0  0  0  0  0 | X:   10 | Y:    6 | Wheel:    0 
E: 000000.821057 5 01 00 0a 06 00
# ReportID: 1 / Button: 0  0  0  0  0  0  0  0 | X:    8 | Y:    7 | Wheel:    0 
E: 000000.829010 5 01 00 08 07 00
# ReportID: 1 / Button: 0  0  0  0  0  0  0  0 | X:    8 | Y:    8 | Wheel:    0 
E: 000000.837081 5 01 00 08 08 00
# ReportID: 1 / Button: 0  0  0  0  0  0  0  0 | X:    7 | Y:    8 | Wheel:    0 
E: 000000.845001 5 01 00 07 08 00
# ReportID: 1 / Button: 0  0  0  0  0  0  0  0 | X:    1 | Y:   10 | Wheel:    0 
E: 000000.853984 5 01 00 01 0a 00
# ReportID: 1 / Button: 0  0  0  0  0  0  0  0 | X:    1 | Y:   10 | Wheel:    0 
E: 000000.862006 5 01 00 01 0a 00
# ReportID: 1 / Button: 0  0  0  0  0  0  0  0 | X:    0 | Y:   10 | Wheel:    0 
E: 000000.869975 5 01 00 00 0a 00
# ReportID: 1 / Button: 0  0  0  0  0  0  0  0 | X:   -3 | Y:   10 | Wheel:    0 
E: 000000.877985 5 01 00 fd 0a 00
# ReportID: 1 / Button: 0  0  0  0  0  0  0  0 | X:   -7 | Y:   10 | Wheel:    0 
E: 000000.885974 5 01 00 f9 0a 00
# ReportID: 1 / Button: 0  0  0  0  0  0  0  0 | X:   -8 | Y:    9 | Wheel:    0 
E: 000000.894009 5 01 00 f8 09 00
# ReportID: 1 / Button: 0  0  0  0  0  0  0  0 | X:  -11 | Y:    9 | Wheel:    0 
E: 000000.902975 5 01 00 f5 09 00
# ReportID: 1 / Button: 0  0  0  0  0  0  0  0 | X:  -25 | Y:   14 | Wheel:    0 
E: 000000.911004 5 01 00 e7 0e 00
# ReportID: 1 / Button: 0  0  0  0  0  0  0  0 | X:  -36 | Y:   13 | Wheel:    0 
E: 000000.919030 5 01 00 dc 0d 00
# ReportID: 1 / Button: 0  0  0  0  0  0  0  0 | X:  -13 | Y:    3 | Wheel:    0 
E: 000000.927020 5 01 00 f3 03 00
# ReportID: 1 / Button: 0  0  0  0  0  0  0  0 | X:  -13 | Y:    2 | Wheel:    0 
E: 000000.935036 5 01 00 f3 02 00
# ReportID: 1 / Button: 0  0  0  0  0  0  0  0 | X:  -20 | Y:    1 | Wheel:    0 
E: 000000.943026 5 01 00 ec 01 00
# ReportID: 1 / Button: 0  0  0  0  0  0  0  0 | X:  -12 | Y:    1 | Wheel:    0 
E: 000000.951096 5 01 00 f4 01 00
# ReportID: 1 / Button: 0  0  0  0  0  0  0  0 | X:  -12 | Y:    0 | Wheel:    0 
E: 000000.960017 5 01 00 f4 00 00
# ReportID: 1 / Button: 0  0  0  0  0  0  0  0 | X:  -11 | Y:   -1 | Wheel:    0 
E: 000000.968010 5 01 00 f5 ff 00
# ReportID: 1 / Button: 0  0  0  0  0  0  0  0 | X:  -11 | Y:   -3 | Wheel:    0 
E: 000000.976067 5 01 00 f5 fd 00
# ReportID: 1 / Button: 0  0  0  0  0  0  0  0 | X:  -12 | Y:   -4 | Wheel:    0 
E: 000000.984020 5 01 00 f4 fc 00
# ReportID: 1 / Button: 0  0  0  0  0  0  0  0 | X:   -7 | Y:   -7 | Wheel:    0 
E: 000000.992057 5 01 00 f9 f9 00
# ReportID: 1 / Button: 0  0  0  0  0  0  0  0 | X:   -6 | Y:   -8 | Wheel:    0 
E: 000001.001035 5 01 00 fa f8 00
# ReportID: 1 / Button: 0  0  0  0  0  0  0  0 | X:   -2 | Y:   -9 | Wheel:    0 
E: 000001.009003 5 01 00 fe f7 00
# ReportID: 1 / Button: 0  0  0  0  0  0  0  0 | X:    0 | Y:  -10 | Wheel:    0 
E: 000001.017085 5 01 00 00 f6 00
# ReportID: 1 / Button: 0  0  0  0  0  0  0  0 | X:    1 | Y:   -9 | Wheel:    0 
E: 000001.025293 5 01 00 01 f7 00
# ReportID: 1 / Button: 0  0  0  0  0  0  0  0 | X:    4 | Y:   -9 | Wheel:    0 
E: 000001.033023 5 01 00 04 f7 00
# ReportID: 1 / Button: 0  0  0  0  0  0  0  0 | X:    7 | Y:   -9 | Wheel:    0 
E: 000001.041082 5 01 00 07 f7 00
# ReportID: 1 / Button: 0  0  0  0  0  0  0  0 | X:    9 | Y:   -8 | Wheel:    0 
E: 000001.049997 5 01 00 09 f8 00
# ReportID: 1 / Button: 0  0  0  0  0  0  0  0 | X:    9 | Y:   -8 | Wheel:    0 
E: 000001.057976 5 01 00 09 f8 00
# ReportID: 1 / Button: 0  0  0  0  0  0  0  0 | X:   10 | Y:   -6 | Wheel:    0 
E: 000001.066033 5 01 00 0a fa 00
# ReportID: 1 / Button: 0  0  0  0  0  0  0  0 | X:   11 | Y:   -6 | Wheel:    0 
E: 000001.073978 5 01 00 0b fa 00
# ReportID: 1 / Button: 0  0  0  0  0  0  0  0 | X:   11 | Y:   -4 | Wheel:    0 
E: 000001.082016 5 01 00 0b fc 00
# ReportID: 1 / Button: 0  0  0  0  0  0  0  0 | X:   11 | Y:   -2 | Wheel:    0 
E: 000001.090015 5 01 00 0b fe 00
# ReportID: 1 / Button: 0  0  0  0  0  0  0  0 | X:   11 | Y:   -1 | Wheel:    0 
E: 000001.098014 5 01 00 0b ff 00
# ReportID: 1 / Button: 0  0  0  0  0  0  0  0 | X:   20 | Y:   -1 | Wheel:    0 
E: 000001.107026 5 01 00 14 ff 00
# ReportID: 1 / Button: 0  0  0  0  0  0  0  0 | X:   13 | Y:    0 | Wheel:    0 
E: 000001.115004 5 01 00 0d 00 00
# ReportID: 1 / Button: 0  0  0  0  0  0  0  0 | X:   12 | Y:    0 | Wheel:    0 
E: 000001.122990 5 01 00 0c 00 00
# ReportID: 1 / Button: 0  0  0  0  0  0  0  0 | X:   17 | Y:    2 | Wheel:    0 
E: 000001.131014 5 01 00 11 02 00
# ReportID: 1 / Button: 0  0  0  0  0  0  0  0 | X:   12 | Y:    2 | Wheel:    0 
E: 000001.139017 5 01 00 0c 02 00
# ReportID: 1 / Button: 0  0  0  0  0  0  0  0 | X:   10 | Y:    2 | Wheel:    0 
E: 000001.146995 5 01 00 0a 02 00
# ReportID: 1 / Button: 0  0  0  0  0  0  0  0 | X:   10 | Y:    3 | Wheel:    0 
E: 000001.156038 5 01 00 0a 03 00
# ReportID: 1 / Button: 0  0  0  0  0  0  0  0 | X:    9 | Y:    1 | Wheel:    0 
E: 000001.163998 5 01 00 09 01 00
# ReportID: 1 / Button: 0  0  0  0  0  0  0  0 | X:    7 | Y:    2 | Wheel:    0 
E: 000001.171978 5 01 00 07 02 00
# ReportID: 1 / Button: 0  0  0  0  0  0  0  0 | X:    7 | Y:    1 | Wheel:    0 
E: 000001.180044 5 01 00 07 01 00
# ReportID: 1 / Button: 0  0  0  0  0  0  0  0 | X:    6 | Y:    1 | Wheel:    0 
E: 000001.188034 5 01 00 06 01 00
# ReportID: 1 / Button: 0  0  0  0  0  0  0  0 | X:    3 | Y:    1 | Wheel:    0 
E: 000001.195996 5 01 00 03 01 00
# ReportID: 1 / Button: 0  0  0  0  0  0  0  0 | X:    4 | Y:    1 | Wheel:    0 
E: 000001.203995 5 01 00 04 01 00
# ReportID: 1 / Button: 0  0  0  0  0  0  0  0 | X:    2 | Y:    1 | Wheel:    0 
E: 000001.213037 5 01 00 02 01 00
# ReportID: 1 / Button: 0  0  0  0  0  0  0  0 | X:    3 | Y:    1 | Wheel:    0 
E: 000001.221050 5 01 00 03 01 00
# ReportID: 1 / Button: 0  0  0  0  0  0  0  0 | X:    1 | Y:    0 | Wheel:    0 
E: 000001.229044 5 01 00 01 00 00
# ReportID: 1 / Button: 0  0  0  0  0  0  0  0 | X:    2 | Y:    0 | Wheel:    0 
E: 000001.237041 5 01 00 02 00 00
# ReportID: 1 / Button: 0  0  0  0  0  0  0  0 | X:    1 | Y:   -1 | Wheel:    0 
E: 000001.245020 5 01 00 01 ff 00
# ReportID: 1 / Button: 0  0  0  0  0  0  0  0 | X:    0 | Y:   -2 | Wheel:    0 
E: 000001.252995 5 01 00 00 fe 00
# ReportID: 1 / Button: 0  0  0  0  0  0  0  0 | X:    0 | Y:   -4 | Wheel:    0 
E: 000001.261986 5 01 00 00 fc 00
# ReportID: 1 / Button: 0  0  0  0  0  0  0  0 | X:    0 | Y:   -4 | Wheel:    0 
E: 000001.270036 5 01 00 00 fc 00
# ReportID: 1 / Button: 0  0  0  0  0  0  0  0 | X:    0 | Y:   -4 | Wheel:    0 
E: 000001.278045 5 01 00 00 fc 00
# ReportID: 1 / Button: 0  0  0  0  0  0  0  0 | X:   -1 | Y:   -4 | Wheel:    0 
E: 000001.286031 5 01 00 ff fc 00
# ReportID: 1 / Button: 0  0  0  0  0  0  0  0 | X:   -1 | Y:   -4 | Wheel:    0 
E: 000001.294021 5 01 00 ff fc 00
# ReportID: 1 / Button: 0  0  0  0  0  0  0  0 | X:   -2 | Y:   -3 | Wheel:    0 
E: 000001.302004 5 01 00 fe fd 00
# ReportID: 1 / Button: 0  0  0  0  0  0  0  0 | X:   -4 | Y:   -3 | Wheel:    0 
E: 000001.311042 5 01 00 fc fd 00
# ReportID: 1 / Button: 0  0  0  0  0  0  0  0 | X:   -6 | Y:   -3 | Wheel:    0 
E: 000001.319059 5 01 00 fa fd 00
# ReportID: 1 / Button: 0  0  0  0  0  0  0  0 | X:   -8 | Y:   -2 | Wheel:    0 
E: 000001.327014 5 01 00 f8 fe 00
# ReportID: 1 / Button: 0  0  0  0  0  0  0  0 | X:   -9 | Y:   -2 | Wheel:    0 
E: 000001.335063 5 01 00 f7 fe 00
# ReportID: 1 / Button: 0  0  0  0  0  0  0  0 | X:   -8 | Y:   -1 | Wheel:    0 
E: 000001.343034 5 01 00 f8 ff 00
# ReportID: 1 / Button: 0  0  0  0  0  0  0  0 | X:   -9 | Y:   -1 | Wheel:    0 
E: 000001.351004 5 01 00 f7 ff 00
# ReportID: 1 / Button: 0  0  0  0  0  0  0  0 | X:   -8 | Y:   -1 | Wheel:    0 
E: 000001.360049 5 01 00 f8 ff 00
# ReportID: 1 / Button: 0  0  0  0  0  0  0  0 | X:   -8 | Y:   -1 | Wheel:    0 
E: 000001.368036 5 01 00 f8 ff 00
# ReportID: 1 / Button: 0  0  0  0  0  0  0  0 | X:   -8 | Y:    0 | Wheel:    0 
E: 000001.375992 5 01 00 f8 00 00
# ReportID: 1 / Button: 0  0  0  0  0  0  0  0 | X:   -8 | Y:    0 | Wheel:    0 
E: 000001.384041 5 01 00 f8 00 00
# ReportID: 1 / Button: 0  0  0  0  0  0  0  0 | X:   -8 | Y:    0 | Wheel:    0 
E: 000001.392012 5 01 00 f8 00 00
# ReportID: 1 / Button: 0  0  0  0  0  0  0  0 | X:   -7 | Y:    1 | Wheel:    0 
E: 000001.399999 5 01 00 f9 01 00
# ReportID: 1 / Button: 0  0  0  0  0  0  0  0 | X:   -7 | Y:    1 | Wheel:    0 
E: 000001.409141 5 01 00 f9 01 00
# ReportID: 1 / Button: 0  0  0  0  0  0  0  0 | X:   -6 | Y:    1 | Wheel:    0 
E: 000001.417031 5 01 00 fa 01 00
# ReportID: 1 / Button: 0  0  0  0  0  0  0  0 | X:   -4 | Y:    2 | Wheel:    0 
E: 000001.425100 5 01 00 fc 02 00
# ReportID: 1 / Button: 0  0  0  0  0  0  0  0 | X:   -4 | Y:    3 | Wheel:    0 
E: 000001.433097 5 01 00 fc 03 00
# ReportID: 1 / Button: 0  0  0  0  0  0  0  0 | X:   -3 | Y:    3 | Wheel:    0 
E: 000001.441007 5 01 00 fd 03 00
# ReportID: 1 / Button: 0  0  0  0  0  0  0  0 | X:   -2 | Y:    4 | Wheel:    0 
E: 000001.448994 5 01 00 fe 04 00
# ReportID: 1 / Button: 0  0  0  0  0  0  0  0 | X:   -3 | Y:    6 | Wheel:    0 
E: 000001.457034 5 01 00 fd 06 00
# ReportID: 1 / Button: 0  0  0  0  0  0  0  0 | X:   -1 | Y:    7 | Wheel:    0 
E: 000001.466079 5 01 00 ff 07 00
# ReportID: 1 / Button: 0  0  0  0  0  0  0  0 | X:    0 | Y:    9 | Wheel:    0 
E: 000001.474193 5 01 00 00 09 00
# ReportID: 1 / Button: 0  0  0  0  0  0  0  0 | X:    1 | Y:    8 | Wheel:    0 
E: 000001.482071 5 01 00 01 08 00
# ReportID: 1 / Button: 0  0  0  0  0  0  0  0 | X:    4 | Y:    8 | Wheel:    0 
E: 000001.490032 5 01 00 04 08 00
# ReportID: 1 / Button: 0  0  0  0  0  0  0  0 | X:    4 | Y:    8 | Wheel:    0 
E: 000001.498070 5 01 00 04 08 00
# ReportID: 1 / Button: 0  0  0  0  0  0  0  0 | X:    7 | Y:    7 | Wheel:    0 
E: 000001.506020 5 01 00 07 07 00
# ReportID: 1 / Button: 0  0  0  0  0  0  0  0 | X:    7 | Y:    7 | Wheel:    0 
E: 000001.515082 5 01 00 07 07 00
# ReportID: 1 / Button: 0  0  0  0  0  0  0  0 | X:    6 | Y:    4 | Wheel:    0 
E: 000001.523069 5 01 00 06 04 00
# ReportID: 1 / Button: 0  0  0  0  0  0  0  0 | X:    7 | Y:    4 | Wheel:    0 
E: 000001.531074 5 01 00 07 04 00
# ReportID: 1 / Button: 0  0  0  0  0  0  0  0 | X:    4 | Y:    3 | Wheel:    0 
E: 000001.539184 5 01 00 04 03 00
# ReportID: 1 / Button: 0  0  0  0  0  0  0  0 | X:    4 | Y:    3 | Wheel:    0 
E: 000001.547060 5 01 00 04 03 00
# ReportID: 1 / Button: 0  0  0  0  0  0  0  0 | X:    4 | Y:    2 | Wheel:    0 
E: 000001.554992 5 01 00 04 02 00
# ReportID: 1 / Button: 0  0  0  0  0  0  0  0 | X:    3 | Y:    1 | Wheel:    0 
E: 000001.563026 5 01 00 03 01 00
# ReportID: 1 / Button: 0  0  0  0  0  0  0  0 | X:    2 | Y:    0 | Wheel:    0 
E: 000001.572036 5 01 00 02 00 00
# ReportID: 1 / Button: 0  0  0  0  0  0  0  0 | X:    3 | Y:    0 | Wheel:    0 
E: 000001.580039 5 01 00 03 00 00
# ReportID: 1 / Button: 0  0  0  0  0  0  0  0 | X:    2 | Y:   -3 | Wheel:    0 
E: 000001.588058 5 01 00 02 fd 00
# ReportID: 1 / Button: 0  0  0  0  0  0  0  0 | X:    1 | Y:   -4 | Wheel:    0 
E: 000001.596061 5 01 00 01 fc 00
# ReportID: 1 / Button: 0  0  0  0  0  0  0  0 | X:    1 | Y:   -7 | Wheel:    0 
E: 000001.604005 5 01 00 01 f9 00
# ReportID: 1 / Button: 0  0  0  0  0  0  0  0 | X:    0 | Y:   -7 | Wheel:    0 
E: 000001.612011 5 01 00 00 f9 00
# ReportID: 1 / Button: 0  0  0  0  0  0  0  0 | X:   -1 | Y:   -8 | Wheel:    0 
E: 000001.621055 5 01 00 ff f8 00
# ReportID: 1 / Button: 0  0  0  0  0  0  0  0 | X:   -2 | Y:   -9 | Wheel:    0 
E: 000001.629016 5 01 00 fe f7 00
# ReportID: 1 / Button: 0  0  0  0  0  0  0  0 | X:   -2 | Y:   -8 | Wheel:    0 
E: 000001.637012 5 01 00 fe f8 00
# ReportID: 1 / Button: 0  0  0  0  0  0  0  0 | X:   -3 | Y:   -8 | Wheel:    0 
E: 000001.645002 5 01 00 fd f8 00
# ReportID: 1 / Button: 0  0  0  0  0  0  0  0 | X:   -3 | Y:   -8 | Wheel:    0 
E: 000001.653005 5 01 00 fd f8 00
# ReportID: 1 / Button: 0  0  0  0  0  0  0  0 | X:   -4 | Y:   -6 | Wheel:    0 
E: 000001.662008 5 01 00 fc fa 00
# ReportID: 1 / Button: 0  0  0  0  0  0  0  0 | X:   -3 | Y:   -6 | Wheel:    0 
E: 000001.670051 5 01 00 fd fa 00
# ReportID: 1 / Button: 0  0  0  0  0  0  0  0 | X:   -3 | Y:   -3 | Wheel:    0 
E: 000001.678004 5 01 00 fd fd 00
# ReportID: 1 / Button: 0  0  0  0  0  0  0  0 | X:   -2 | Y:   -3 | Wheel:    0 
E: 000001.686012 5 01 00 fe fd 00
# ReportID: 1 / Button: 0  0  0  0  0  0  0  0 | X:   -4 | Y:   -2 | Wheel:    0 
E: 000001.693990 5 01 00 fc fe 00
# ReportID: 1 / Button: 0  0  0  0  0  0  0  0 | X:   -7 | Y:   -1 | Wheel:    0 
E: 000001.702024 5 01 00 f9 ff 00
# ReportID: 1 / Button: 0  0  0  0  0  0  0  0 | X:   -6 | Y:    0 | Wheel:    0 
E: 000001.710008 5 01 00 fa 00 00
# ReportID: 1 / Button: 0  0  0  0  0  0  0  0 | X:   -7 | Y:    0 | Wheel:    0 
E: 000001.719082 5 01 00 f9 00 00
# ReportID: 1 / Button: 0  0  0  0  0  0  0  0 | X:   -4 | Y:    0 | Wheel:    0 
E: 000001.727603 5 01 00 fc 00 00
# ReportID: 1 / Button: 0  0  0  0  0  0  0  0 | X:   -4 | Y:    0 | Wheel:    0 
E: 000001.735031 5 01 00 fc 00 00
# ReportID: 1 / Button: 0  0  0  0  0  0  0  0 | X:   -3 | Y:    1 | Wheel:    0 
E: 000001.742991 5 01 00 fd 01 00
# ReportID: 1 / Button: 0  0  0  0  0  0  0  0 | X:   -3 | Y:    1 | Wheel:    0 
E: 000001.751027 5 01 00 fd 01 00
# ReportID: 1 / Button: 0  0  0  0  0  0  0  0 | X:   -2 | Y:    2 | Wheel:    0 
E: 000001.758994 5 01 00 fe 02 00
# ReportID: 1 / Button: 0  0  0  0  0  0  0  0 | X:   -1 | Y:    2 | Wheel:    0 
E: 000001.768029 5 01 00 ff 02 00
# ReportID: 1 / Button: 0  0  0  0  0  0  0  0 | X:    0 | Y:    3 | Wheel:    0 
E: 000001.776047 5 01 00 00 03 00
# ReportID: 1 / Button: 0  0  0  0  0  0  0  0 | X:    0 | Y:    3 | Wheel:    0 
E: 000001.784038 5 01 00 00 03 00
# ReportID: 1 / Button: 0  0  0  0  0  0  0  0 | X:    1 | Y:    4 | Wheel:    0 
E: 000001.792064 5 01 00 01 04 00
# ReportID: 1 / Button: 0  0  0  0  0  0  0  0 | X:    2 | Y:    6 | Wheel:    0 
E: 000001.800024 5 01 00 02 06 00
# ReportID: 1 / Button: 0  0  0  0  0  0  0  0 | X:    2 | Y:    4 | Wheel:    0 
E: 000001.808010 5 01 00 02 04 00
# ReportID: 1 / Button: 0  0  0  0  0  0  0  0 | X:    2 | Y:    4 | Wheel:    0 
E: 000001.817057 5 01 00 02 04 00
# ReportID: 1 / Button: 0  0  0  0  0  0  0  0 | X:    1 | Y:    3 | Wheel:    0 
E: 000001.825060 5 01 00 01 03 00
# ReportID: 1 / Button: 0  0  0  0  0  0  0  0 | X:    3 | Y:    2 | Wheel:    0 
E: 000001.833050 5 01 00 03 02 00
# ReportID: 1 / Button: 0  0  0  0  0  0  0  0 | X:    2 | Y:    2 | Wheel:    0 
E: 000001.841043 5 01 00 02 02 00
# ReportID: 1 / Button: 0  0  0  0  0  0  0  0 | X:    1 | Y:    1 | Wheel:    0 
E: 000001.849031 5 01 00 01 01 00
# ReportID: 1 / Button: 0  0  0  0  0  0  0  0 | X:    1 | Y:    2 | Wheel:    0 
E: 000001.857014 5 01 00 01 02 00
# ReportID: 1 / Button: 0  0  0  0  0  0  0  0 | X:    1 | Y:    1 | Wheel:    0 
E: 000001.866046 5 01 00 01 01 00
# ReportID: 1 / Button: 0  0  0  0  0  0  0  0 | X:    0 | Y:    1 | Wheel:    0 
E: 000001.874055 5 01 00 00 01 00
# ReportID: 1 / Button: 0  0  0  0  0  0  0  0 | X:    1 | Y:    1 | Wheel:    0 
E: 000001.882067 5 01 00 01 01 00
# ReportID: 1 / Button: 0  0  0  0  0  0  0  0 | X:    0 | Y:    1 | Wheel:    0 
E: 000001.890021 5 01 00 00 01 00
# ReportID: 1 / Button: 0  0  0  0  0  0  0  0 | X:    0 | Y:    1 | Wheel:    0 
E: 000001.898016 5 01 00 00 01 00
# ReportID: 1 / Button: 0  0  0  0  0  0  0  0 | X:    0 | Y:    1 | Wheel:    0 
E: 000001.906001 5 01 00 00 01 00
# ReportID: 1 / Button: 0  0  0  0  0  0  0  0 | X:    0 | Y:    1 | Wheel:    0 
E: 000001.915027 5 01 00 00 01 00
# ReportID: 1 / Button: 0  0  0  0  0  0  0  0 | X:    0 | Y:    1 | Wheel:    0 
E: 000001.923098 5 01 00 00 01 00
# ReportID: 1 / Button: 0  0  0  0  0  0  0  0 | X:    0 | Y:    1 | Wheel:    0 
E: 000001.939033 5 01 00 00 01 00
# ReportID: 1 / Button: 0  0  0  0  0  0  0  0 | X:    1 | Y:    0 | Wheel:    0 
E: 000001.947042 5 01 00 01 00 00
# ReportID: 1 / Button: 0  0  0  0  0  0  0  0 | X:    1 | Y:    0 | Wheel:    0 
E: 000001.972160 5 01 00 01 00 00
# ReportID: 1 / Button: 0  0  0  0  0  0  0  0 | X:    1 | Y:    0 | Wheel:    0 
E: 000001.988037 5 01 00 01 00 00
# ReportID: 1 / Button: 0  0  0  0  0  0  0  0 | X:    0 | Y:   -1 | Wheel:    0 
E: 000001.996038 5 01 00 00 ff 00
# ReportID: 1 / Button: 0  0  0  0  0  0  0  0 | X:    1 | Y:   -1 | Wheel:    0 
E: 000002.004019 5 01 00 01 ff 00
# ReportID: 1 / Button: 0  0  0  0  0  0  0  0 | X:    0 | Y:   -1 | Wheel:    0 
E: 000002.012012 5 01 00 00 ff 00
# ReportID: 1 / Button: 0  0  0  0  0  0  0  0 | X:    0 | Y:   -1 | Wheel:    0 
E: 000002.021088 5 01 00 00 ff 00
# ReportID: 1 / Button: 0  0  0  0  0  0  0  0 | X:    0 | Y:   -1 | Wheel:    0 
E: 000002.029070 5 01 00 00 ff 00
# ReportID: 1 / Button: 0  0  0  0  0  0  0  0 | X:    0 | Y:   -1 | Wheel:    0 
E: 000002.037096 5 01 00 00 ff 00
# ReportID: 1 / Button: 0  0  0  0  0  0  0  0 | X:    0 | Y:   -1 | Wheel:    0 
E: 000002.045064 5 01 00 00 ff 00
# ReportID: 1 / Button: 0  0  0  0  0  0  0  0 | X:    0 | Y:   -1 | Wheel:    0 
E: 000002.053047 5 01 00 00 ff 00
# ReportID: 1 / Button: 0  0  0  0  0  0  0  0 | X:    0 | Y:   -1 | Wheel:    0 
E: 000002.061302 5 01 00 00 ff 00
# ReportID: 1 / Button: 0  0  0  0  0  0  0  0 | X:    0 | Y:   -1 | Wheel:    0 
E: 000002.069032 5 01 00 00 ff 00
# ReportID: 1 / Button: 0  0  0  0  0  0  0  0 | X:    0 | Y:   -1 | Wheel:    0 
E: 000002.078041 5 01 00 00 ff 00
# ReportID: 1 / Button: 0  0  0  0  0  0  0  0 | X:    0 | Y:   -1 | Wheel:    0 
E: 000002.086035 5 01 00 00 ff 00
# ReportID: 1 / Button: 0  0  0  0  0  0  0  0 | X:    0 | Y:   -1 | Wheel:    0 
E: 000002.094069 5 01 00 00 ff 00
# ReportID: 1 / Button: 0  0  0  0  0  0  0  0 | X:    0 | Y:   -1 | Wheel:    0 
E: 000002.102024 5 01 00 00 ff 00
# ReportID: 1 / Button: 0  0  0  0  0  0  0  0 | X:    0 | Y:   -1 | Wheel:    0 
E: 000002.110284 5 01 00 00 ff 00
# ReportID: 1 / Button: 0  0  0  0  0  0  0  0 | X:   -1 | Y:   -1 | Wheel:    0 
E: 000002.118066 5 01 00 ff ff 00
# ReportID: 1 / Button: 0  0  0  0  0  0  0  0 | X:   -1 | Y:   -1 | Wheel:    0 
E: 000002.127069 5 01 00 ff ff 00
# ReportID: 1 / Button: 1  0  0  0  0  0  0  0 | X:    0 | Y:    0 | Wheel:    0 
E: 000002.183049 5 01 01 00 00 00
# ReportID: 1 / Button: 0  0  0  0  0  0  0  0 | X:    0 | Y:    0 | Wheel:    0 
E: 000002.324050 5 01 00 00 00 00
# ReportID: 1 / Button: 0  0  0  0  0  0  0  0 | X:   -1 | Y:   -1 | Wheel:    0 
E: 000002.732111 5 01 00 ff ff 00
# ReportID: 1 / Button: 0  0  0  0  0  0  0  0 | X:    0 | Y:   -1 | Wheel:    0 
E: 000002.740123 5 01 00 00 ff 00
# ReportID: 1 / Button: 0  0  0  0  0  0  0  0 | X:    0 | Y:   -1 | Wheel:    0 
E: 000002.757133 5 01 00 00 ff 00
# ReportID: 1 / Button: 0  0  0  0  0  0  0  0 | X:    0 | Y:   -1 | Wheel:    0 
E: 000002.765071 5 01 00 00 ff 00
# ReportID: 1 / Button: 0  0  0  0  0  0  0  0 | X:   -1 | Y:    0 | Wheel:    0 
E: 000002.773035 5 01 00 ff 00 00
# ReportID: 1 / Button: 0  0  0  0  0  0  0  0 | X:    0 | Y:   -1 | Wheel:    0 
E: 000002.781040 5 01 00 00 ff 00
# ReportID: 1 / Button: 0  0  0  0  0  0  0  0 | X:    0 | Y:   -1 | Wheel:    0 
E: 000002.789036 5 01 00 00 ff 00
# ReportID: 1 / Button: 1  0  0  0  0  0  0  0 | X:    0 | Y:    0 | Wheel:    0 
E: 000002.846219 5 01 01 00 00 00
# ReportID: 1 / Button: 0  0  0  0  0  0  0  0 | X:    0 | Y:    0 | Wheel:    0 
E: 000003.028225 5 01 00 00 00 00
# ReportID: 1 / Button: 1  0  0  0  0  0  0  0 | X:    0 | Y:    0 | Wheel:    0 
E: 000003.297112 5 01 01 00 00 00
# ReportID: 1 / Button: 0  0  0  0  0  0  0  0 | X:    0 | Y:    0 | Wheel:    0 
E: 000003.430241 5 01 00 00 00 00
# ReportID: 1 / Button: 1  0  0  0  0  0  0  0 | X:    0 | Y:    0 | Wheel:    0 
E: 000003.666168 5 01 01 00 00 00
# ReportID: 1 / Button: 0  1  0  0  0  0  0  0 | X:    0 | Y:    0 | Wheel:    0 
E: 000004.133186 5 01 02 00 00 00
# ReportID: 1 / Button: 0  0  0  0  0  0  0  0 | X:    0 | Y:    0 | Wheel:    0 
E: 000004.141185 5 01 00 00 00 00
# ReportID: 1 / Button: 0  0  0  0  0  0  0  0 | X:    0 | Y:    0 | Wheel:    0 
E: 000004.372245 5 01 00 00 00 00
# ReportID: 1 / Button: 1  0  0  0  0  0  0  0 | X:    0 | Y:    0 | Wheel:    0 
E: 000004.803127 5 01 01 00 00 00
# ReportID: 1 / Button: 0  0  0  0  0  0  0  0 | X:    0 | Y:    0 | Wheel:    0 
E: 000004.830121 5 01 00 00 00 00
# ReportID: 1 / Button: 0  0  0  0  0  0  0  0 | X:    0 | Y:   -1 | Wheel:    0 
E: 000005.238252 5 01 00 00 ff 00
# ReportID: 1 / Button: 0  0  0  0  0  0  0  0 | X:   -1 | Y:    0 | Wheel:    0 
E: 000005.246177 5 01 00 ff 00 00
# ReportID: 1 / Button: 0  0  0  0  0  0  0  0 | X:   -1 | Y:   -1 | Wheel:    0 
E: 000005.254242 5 01 00 ff ff 00
# ReportID: 1 / Button: 0  0  0  0  0  0  0  0 | X:   -1 | Y:   -1 | Wheel:    0 
E: 000005.262193 5 01 00 ff ff 00
# ReportID: 1 / Button: 0  0  0  0  0  0  0  0 | X:   -1 | Y:   -1 | Wheel:    0 
E: 000005.279233 5 01 00 ff ff 00
# ReportID: 1 / Button: 0  0  0  0  0  0  0  0 | X:   -1 | Y:   -1 | Wheel:    0 
E: 000005.287208 5 01 00 ff ff 00
# ReportID: 1 / Button: 1  0  0  0  0  0  0  0 | X:    0 | Y:    0 | Wheel:    0 
E: 000005.344205 5 01 01 00 00 00
# ReportID: 1 / Button: 0  0  0  0  0  0  0  0 | X:    0 | Y:    0 | Wheel:    0 
E: 000005.379319 5 01 00 00 00 00
# ReportID: 1 / Button: 0  0  0  0  0  0  0  0 | X:    0 | Y:    0 | Wheel:    0 
E: 000005.508161 5 01 00 00 00 00
