edid-decode (hex):

00 ff ff ff ff ff ff 00 36 7f 01 00 01 00 00 00
00 0c 01 03 a5 08 0d 78 2f 00 00 a0 57 49 9b 26
10 48 4f 00 00 00 01 01 01 01 01 01 01 01 01 01
01 01 01 01 01 01 aa 35 38 60 40 80 19 70 48 08
f2 00 00 00 00 00 00 18 00 00 00 00 00 00 00 00
00 00 00 00 00 00 00 00 00 00 00 00 00 00 00 00
00 00 00 00 00 00 00 00 00 00 00 00 00 00 00 00
00 00 00 00 00 00 00 00 00 00 00 00 00 00 00 0c

00 00 00 00 00 00 00 00 00 00 00 00 00 00 00 00
00 00 00 00 00 00 00 00 00 00 00 00 00 00 00 00
00 00 00 00 00 00 00 00 00 00 00 00 00 00 00 00
00 00 00 00 00 00 00 00 00 00 00 00 00 00 00 00
00 00 00 00 00 00 00 00 00 00 00 00 00 00 00 00
00 00 00 00 00 00 00 00 00 00 00 00 00 00 00 00
00 00 00 00 00 00 00 00 00 00 00 00 00 00 00 00
00 00 00 00 00 00 00 00 00 00 00 00 00 00 00 00

----------------

Block 0, Base EDID:
  EDID Structure Version & Revision: 1.3
  Vendor & Product Identification:
    Manufacturer: MS_
    Model: 1
    Serial Number: 1
    Made in: 2002
  Basic Display Parameters & Features:
    Digital display
    DFP 1.x compatible TMDS
    Maximum image size: 8 cm x 13 cm
    Gamma: 2.20
    DPMS levels: Off
    RGB color display
    Default (sRGB) color space is primary color space
    First detailed timing is the preferred timing
    Supports GTF timings within operating range
  Color Characteristics:
    Red  : 0.6250, 0.3398
    Green: 0.2851, 0.6054
    Blue : 0.1484, 0.0625
    White: 0.2812, 0.3085
  Established Timings I & II: none
  Standard Timings: none
  Detailed Timing Descriptors:
    DTD 1:  1080x1920   60.061557 Hz   9:16   116.820 kHz    137.380000 MHz
                 Hfront   72 Hsync   8 Hback   16 Hpol N
                 Vfront   15 Vsync   2 Vback    8 Vpol N
    Empty Descriptor
    Empty Descriptor
    Empty Descriptor
Checksum: 0x0c

----------------

Block 1, Unknown EDID Extension Block 0x00:
  00 00 00 00 00 00 00 00 00 00 00 00 00 00 00 00 '................'
  00 00 00 00 00 00 00 00 00 00 00 00 00 00 00 00 '................'
  00 00 00 00 00 00 00 00 00 00 00 00 00 00 00 00 '................'
  00 00 00 00 00 00 00 00 00 00 00 00 00 00 00 00 '................'
  00 00 00 00 00 00 00 00 00 00 00 00 00 00 00 00 '................'
  00 00 00 00 00 00 00 00 00 00 00 00 00 00 00 00 '................'
  00 00 00 00 00 00 00 00 00 00 00 00 00 00 00 00 '................'
  00 00 00 00 00 00 00 00 00 00 00 00 00 00 00 00 '................'
Checksum: 0x00

----------------

Preferred Video Timing if only Block 0 is parsed:
  DTD   1:  1080x1920   60.061557 Hz   9:16   116.820 kHz    137.380000 MHz
                 Hfront   72 Hsync   8 Hback   16 Hpol N
                 Vfront   15 Vsync   2 Vback    8 Vpol N

----------------

Native Video Resolution:
  1080x1920

----------------

edid-decode SHA: 84ddf9155376 2021-10-03 10:37:45

Warnings:

Block 0, Base EDID:
  Basic Display Parameters & Features: Dubious maximum image size (8x13 is smaller than 10x10 cm).

Failures:

Block 0, Base EDID:
  Vendor & Product Identification: Manufacturer name field contains garbage.
  Basic Display Parameters & Features: Digital Video Interface Standard set to reserved value 0x24.
  Basic Display Parameters & Features: sRGB is signaled, but the chromaticities do not match.
  Detailed Timing Descriptor #1: Mismatch of image size vs display size: image size is not set, but display size is.
  Empty Descriptor: Use Dummy Descriptor instead of all zeroes.
  Empty Descriptor: Use Dummy Descriptor instead of all zeroes.
  Empty Descriptor: Use Dummy Descriptor instead of all zeroes.
  Base EDID: EDID specified 0 extension block(s), but found 1 extension block(s).
  Missing Display Product Name.
  Missing Display Range Limits Descriptor.
Block 1, Base EDID:
  Unknown Extension Block.

EDID conformity: FAIL